;Title;Producer;Brand;Vintage;Wine Type;Colour;Country;Region;Appellation;Sweetness;Closure;Alcohol;Body;Oak;Grapes
406;Bodega Piedra Negra, L’Esprit de Chacayes, 2019;Bodega Piedra Negra;L’Esprit de Chacayes;2019;Still;Red;Argentina;Los Chacayes, Tunuyán;;Dry;Cork;14.50%;Full;Unoaked;['70% Malbec']
407;Bodegas Caro, CARO, Uco Valley, Paraje Altamira, 2017;Bodegas Caro;CARO;2017;Still;Red;Argentina;Mendoza;Uco Valley;Dry;Cork;14.00%;Full;Oaked;['26% Cabernet Sauvignon', '74% Malbec']
408;Escorihuela Gascón, Organic Vineyard Malbec, 2018;Escorihuela Gascón;Organic Vineyard Malbec;2018;Still;Red;Argentina;El Cepillo, San Carlos;;Dry;Cork;14.00%;Full;Unoaked;['100% Malbec']
409;Domaine Nico, Soeur et Freres La Savante Pinot Noir, 2018;Domaine Nico;Soeur et Freres La Savante Pinot Noir;2018;Still;Red;Argentina;Gualtallary, Tupungato;;Dry;Cork;13.50%;Medium;Oaked;['100% Pinot Noir / Pinot Nero']
410;Trapiche, Terroir Series Finca Laborde Cabernet Sauvignon;Trapiche;Terroir Series Finca Laborde Cabernet Sauvignon;2015;Still;Red;Argentina;La Consulta, San Carlos;;Dry;Cork;14.50%;Full;Oaked;['100% Cabernet Sauvignon']
411;Flechas de los Andes, Gran Corte, 2015;Flechas de los Andes;Gran Corte;2015;Still;Red;Argentina;Vista Flores, Tunuyán;;Dry;Cork;14.50%;Full;Oaked;['Cabernet Franc', 'Malbec', 'Syrah / Shiraz']
412;Bodega Aleanna, Gran Enemigo Single Vineyard Los Chacayes;Bodega Aleanna;Gran Enemigo Single Vineyard Los Chacayes;2016;Still;Red;Argentina;Los Chacayes, Tunuyán;;Dry;Cork;13.50%;Full;Oaked;['85% Cabernet Franc', '15% Malbec']
413;Catena Zapata, DV Catena Malbec, Mendoza, Argentina, 2018;Catena Zapata;DV Catena Malbec;2018;Still;Red;Argentina;Mendoza;;Dry;;;;;['Malbec']
414;Casa Boher, Extra Brut, Uco Valley, Mendoza, Argentina;Casa Boher;Extra Brut;;Sparkling;Rosé;Argentina;Mendoza;Uco Valley;Extra Brut;Cork;12.50%;Light;;['30% Chardonnay', '70% Pinot Noir / Pinot Nero']
415;Terrazas de los Andes, Reserva Malbec, Uco Valley, 2018;Terrazas de los Andes;Reserva Malbec;2018;Still;Red;Argentina;Mendoza;Uco Valley;Dry;Cork;14.00%;Full;Oaked;['100% Malbec']
416;Corvus, Ala Negra, Lulunta, Mendoza, Argentina, 2007;Corvus;Ala Negra;2007;Still;Red;Argentina;Mendoza;Lulunta;Dry;Cork;14.00%;Full;;['100% Malbec']
417;Zuccardi, Blanc de Blancs Cuvee Especial, Mendoza, 2016;Zuccardi;Blanc de Blancs Cuvee Especial;2016;Sparkling;White;Argentina;Mendoza;;Brut;Natural Cork;12.00%;Light;;['100% Chardonnay']
418;Zuccardi, Q Malbec, Uco Valley, Mendoza, Argentina 2018;Zuccardi;Q Malbec;2018;Still;Red;Argentina;Mendoza;Uco Valley;Dry;Cork;14.00%;Medium;Oaked;['100% Malbec']
419;Catena Zapata, Nicolás Catena Zapata, Uco Valley, 2017;Catena Zapata;Nicolás Catena Zapata;2017;Still;Red;Argentina;Mendoza;Uco Valley;Dry;Natural Cork;13.50%;Full;Oaked;['8% Cabernet Franc', '59% Cabernet Sauvignon', '33% Malbec']
420;Altos de Tintogasta, Seismiles, Calchaquí Valley, 2019;Altos de Tintogasta;Seismiles;2019;Still;Red;Argentina;Salta;Calchaquí Valley;Dry;Natural Cork;13.00%;Full;;['100% Syrah / Shiraz']
421;Finca Las Glicinas, Terciopelo, Uco Valley, Altamira, 2018;Finca Las Glicinas;Terciopelo;2018;Still;Red;Argentina;Mendoza;Uco Valley;Dry;Natural Cork;14.50%;Full;Oaked;['100% Syrah / Shiraz']
422;Diamandes, Diamandes de Uco, Uco Valley, Mendoza, 2017;Diamandes;Diamandes de Uco;2017;Still;Red;Argentina;Mendoza;Uco Valley;Dry;Natural Cork;14.00%;Full;Oaked;['100% Syrah / Shiraz']
423;Tapiz, Syrah, Mendoza, Argentina, 2018;Tapiz;Syrah;2018;Still;Red;Argentina;Mendoza;;Dry;Natural Cork;14.00%;Full;Oaked;['100% Syrah / Shiraz']
424;Catena, Animal Orgánico, Uco Valley, Vista Flores, 2018;Catena;Animal Orgánico;2018;Still;Red;Argentina;Mendoza;Uco Valley;Dry;Natural Cork;13.50%;Full;Oaked;['100% Syrah / Shiraz']
425;La Puerta, Clasico, La Rioja, Argentina, 2019;La Puerta;Clasico;2019;Still;Red;Argentina;La Rioja;;Dry;Natural Cork;14.00%;Full;;['Syrah / Shiraz']
426;Durigutti, Cara Sucia, Mendoza, Argentina, 2018;Durigutti;Cara Sucia;2018;Still;Red;Argentina;Mendoza;;Dry;;13.60%;;;['Bonarda', 'Sangiovese', 'Syrah / Shiraz']
427;Altar Uco, Edad Moderna Red Blend, Uco Valley, Tupungato, Argentina, 2018;Altar Uco;Edad Moderna Red Blend;2018;Still;Red;Argentina;Mendoza;Uco Valley;Dry;Cork;14.50%;Medium;Unoaked;['45% Cabernet Franc', '45% Malbec', '25% Merlot']
428;Estancia Uspallata, El Corte, Luján de Cuyo, Mendoza 2018;Estancia Uspallata;El Corte;2018;Still;Red;Argentina;Mendoza;Luján de Cuyo;Dry;Cork;;Full;Oaked;['25% Cabernet Franc', '70% Malbec', '5% Pinot Noir / Pinot Nero']
429;Michelini i Mufatto, Balsa de Piedra Blend de Tintas, Uco Valley 2019;Michelini i Mufatto;Balsa de Piedra Blend de Tintas;2019;Still;Red;Argentina;Mendoza;Uco Valley;Dry;;13.20%;;;['Cabernet Franc', 'Malbec']
430;El Esteco, Chañar Punco, Catamarca, Argentina, 2016;El Esteco;Chañar Punco;2016;Still;Red;Argentina;Catamarca;;Dry;Cork;14.50%;Full;Oaked;['30% Cabernet Sauvignon', '60% Malbec', '10% Merlot']
431;Susana Balbo, Signature White Blend, Uco Valley, Mendoza, 2019;Susana Balbo;Signature White Blend;2019;Still;White;Argentina;Mendoza;Uco Valley;Dry;Natural Cork;13.00%;Medium;Lightly Oaked;['33% Sauvignon Blanc', '33% Sémillon', '33% Torrontés']
432;Susana Balbo, Signature Barrel-Fermented Torrontés, Uco Valley, Mendoza, 2019;Susana Balbo;Signature Barrel-Fermented Torrontés;2019;Still;White;Argentina;Mendoza;Uco Valley;Dry;Screwcap;;Medium;Lightly Oaked;['100% Torrontés']
433;Bodega Norton, Perdriel Series Sauvignon Blanc, 2017;Bodega Norton;Perdriel Series Sauvignon Blanc;2017;Still;White;Argentina;Mendoza;;Dry;Cork;;Medium;Lightly Oaked;['100% Sauvignon Blanc']
434;Riccitelli, Old Vines Semillon, Río Negro, Patagonia, 2019;Riccitelli;Old Vines Semillon;2019;Still;White;Argentina;Patagonia;Río Negro;Dry;Cork;13.00%;Medium;Oaked;['100% Sémillon']
435;El Esteco, Michel Torino Cuma Organic Torrontés, 2019;El Esteco;Michel Torino Cuma Organic Torrontés;2019;Still;White;Argentina;Salta;;Dry;Screwcap;;Medium;Unoaked;['100% Torrontés']
436;Bodega Colomé, Lote Especial Sauvignon Blanc, Salta, 2018;Bodega Colomé;Lote Especial Sauvignon Blanc;2018;Still;White;Argentina;Salta;;Dry;Cork;;Medium;Lightly Oaked;['100% Sauvignon Blanc']
437;Zuccardi, Fósil, Uco Valley, Mendoza, Argentina, 2018;Zuccardi;Fósil;2018;Still;White;Argentina;Mendoza;Uco Valley;Dry;Natural Cork;;Medium;Lightly Oaked;['100% Chardonnay']
438;Bodega Colomé, Estate Torrontes, Calchaquí Valley, 2019;Bodega Colomé;Estate Torrontes;2019;Still;White;Argentina;Salta;Calchaquí Valley;Dry;Screwcap;;Full;Unoaked;['100% Torrontés']
439;Bodega Trapiche, El Esteco Old Vines 1945 Torrontés, Calchaqui Valley, Argentina, 2019;Bodega Trapiche;El Esteco Old Vines 1945 Torrontés;2019;Still;White;Argentina;Salta;Calchaquí Valley;Dry;Cork;14.00%;Full;Unoaked;['100% Torrontés']
440;Viña Zorzal, Eggo Blanc de Cal, Uco Valley, Tupungato, 2018;Viña Zorzal;Eggo Blanc de Cal;2018;Still;White;Argentina;Mendoza;Uco Valley;Dry;Cork;;Light;Unoaked;['100% Sauvignon Blanc']
441;Catena, DV Catena Chardonnay Historico, Mendoza, 2019;Catena;DV Catena Chardonnay Historico;2019;Still;White;Argentina;Mendoza;;Dry;Cork;;Medium;Oaked;['100% Chardonnay']
442;Riccitelli, Blanco de La Casa, Mendoza, Argentina, 2019;Riccitelli;Blanco de La Casa;2019;Still;White;Argentina;Mendoza;;Dry;Cork;;Light;Unoaked;['20% Chardonnay', '40% Sauvignon Blanc', '40% Sémillon']
443;Matervini, Blanco, Uco Valley, Los Chacayes, Mendoza, 2018;Matervini;Blanco;2018;Still;White;Argentina;Mendoza;Uco Valley;Dry;Natural Cork;14.50%;Full;Oaked;['93% Marsanne', '7% Viognier']
444;Catena, Adrianna Vineyard White Stones Chardonnay, Uco Valley, Mendoza, 2018;Catena;Adrianna Vineyard White Stones Chardonnay;2018;Still;White;Argentina;Mendoza;Uco Valley;Dry;Natural Cork;13.50%;Medium;Oaked;['100% Chardonnay']
445;Catena, Appellation Luján de Cuyo White Clay, Luján de Cuyo, Mendoza, 2019;Catena;Appellation Luján de Cuyo White Clay;2019;Still;White;Argentina;Mendoza;Luján de Cuyo;Dry;Cork;;Medium;Oaked;['40% Chenin Blanc', '60% Sémillon']
446;Pulenta Estate, XI Gran Cabernet Franc, Luján de Cuyo, Mendoza, 2017;Pulenta Estate;XI Gran Cabernet Franc;2017;Still;Red;Argentina;Mendoza;Luján de Cuyo;Dry;Natural Cork;14.30%;Full;Oaked;['100% Cabernet Franc']
447;Superuco, Sorella, Uco Valley, Gualtallary, Mendoza, 2016;Superuco;Sorella;2016;Still;Red;Argentina;Mendoza;Uco Valley;Dry;Natural Cork;13.80%;Medium;Oaked;['100% Cabernet Franc']
448;Durigutti, Proyecto Las Compuertas Cabernet Franc, Las Compuertas, Mendoza, 2019;Durigutti;Proyecto Las Compuertas Cabernet Franc;2019;Still;Red;Argentina;Mendoza;Las Compuertas;Dry;Natural Cork;14.00%;Medium;Unoaked;['100% Cabernet Franc']
449;Zuccardi, Polígonos del Valle de Uco Cabernet Franc San Pablo, Uco Valley, 2017;Zuccardi;Polígonos del Valle de Uco Cabernet Franc San Pablo;2019;Still;Red;Argentina;Mendoza;Uco Valley;Dry;Natural Cork;13.00%;Medium;Lightly Oaked;['100% Cabernet Franc']
450;Andeluna, Pasionado Cabernet Franc, Uco Valley, Gualtallary, Mendoza, 2017;Andeluna;Pasionado Cabernet Franc;2017;Still;Red;Argentina;Mendoza;Uco Valley;Dry;Natural Cork;14.00%;Full;Oaked;['100% Cabernet Franc']
451;Rutini, Single Vineyard Gualtallary Cabernet Franc, Uco Valley, 2017;Rutini;Single Vineyard Gualtallary Cabernet Franc;2017;Still;Red;Argentina;Mendoza;Uco Valley;Dry;Natural Cork;12.50%;Full;Lightly Oaked;['100% Cabernet Franc']
452;Bodegas Salentein, Numina Cabernet Franc, Uco Valley, Los Árboles, Mendoza, 2017;Bodegas Salentein;Numina Cabernet Franc;2017;Still;Red;Argentina;Mendoza;Uco Valley;Dry;Natural Cork;14.50%;Full;Oaked;['100% Cabernet Franc']
453;Bodega Aleanna, Gran Enemigo Single Vineyard Agrelo Cabernet Franc, Mendoza, Argentina, 2016;Bodega Aleanna;Gran Enemigo Single Vineyard Agrelo Cabernet Franc;2016;Still;Red;Argentina;Mendoza;Luján de Cuyo;Dry;Natural Cork;13.70%;Full;Oaked;['85% Cabernet Franc', '15% Malbec']
454;Luigi Bosca, Gala 4 Cabernet Franc, Las Compuertas, 2017;Luigi Bosca;Gala 4 Cabernet Franc;2017;Still;Red;Argentina;Mendoza;Las Compuertas;Dry;Natural Cork;13.90%;Full;Oaked;['100% Cabernet Franc']
455;El Esteco, Fincas Notables Cabernet Franc Cuartel #5, Salta, Argentina, 2016;El Esteco;Fincas Notables Cabernet Franc Cuartel #5;2016;Still;Red;Argentina;Salta;Cafayate Valley;Dry;Natural Cork;14.50%;Full;Oaked;['100% Cabernet Franc']
456;Trapiche, Estación 1883 Cabernet Franc, Mendoza, 2018;Trapiche;Estación 1883 Cabernet Franc;2018;Still;Red;Argentina;Mendoza;;Dry;Natural Cork;14.00%;Medium;Lightly Oaked;['100% Cabernet Franc']
457;Bodega Aleanna, El Enemigo Cabernet Franc, Uco Valley, Mendoza, 2017;Bodega Aleanna;El Enemigo Cabernet Franc;2017;Still;Red;Argentina;Mendoza;Uco Valley;Dry;Natural Cork;13.50%;Medium;Oaked;['90% Cabernet Franc', '10% Malbec']
458;Zorzal, Eggo Franco Cabernet Franc, Uco Valley, Gualtallary, 2018;Zorzal;Eggo Franco Cabernet Franc;2018;Still;Red;Argentina;Mendoza;Uco Valley;Dry;Natural Cork;14.50%;Medium;Unoaked;['100% Cabernet Franc']
459;Catena Zapata, DV Catena Tinto Histórico Cabernet Franc, Uco Valley, Mendoza, 2018;Catena Zapata;DV Catena Tinto Histórico Cabernet Franc;2018;Still;Red;Argentina;Mendoza;Uco Valley;Dry;Natural Cork;13.30%;Full;Oaked;['100% Cabernet Franc']
460;Viña Cobos, Bramare Chañares Estate Cabernet Franc, Uco Valley, Mendoza, 2017;Viña Cobos;Bramare Chañares Estate Cabernet Franc;2017;Still;Red;Argentina;Mendoza;Uco Valley;Dry;Natural Cork;14.70%;Full;Oaked;['100% Cabernet Franc']
461;Susana Balbo, BenMarco Cabernet Franc, Uco Valley, Paraje Altamira, Mendoza, 2018;Susana Balbo;BenMarco Cabernet Franc;2018;Still;Red;Argentina;;;;;;;;
462;Bodega Norton, Altura Cabernet Franc, Uco Valley, Paraje Altamira, Mendoza, 2018;Bodega Norton;Altura Cabernet Franc;2018;Still;Red;Argentina;Mendoza;Uco Valley;Dry;Natural Cork;14.50%;Full;Oaked;['100% Cabernet Franc']
463;Pyros Wines, Special Blend, Pedernal Valley, 2014;Pyros Wines;Special Blend;2014;Still;Red;Argentina;Pedernal Valley;Pedernal Valley;Dry;Cork;14.00%;Full;Oaked;['8% Cabernet Sauvignon', '70% Malbec', '22% Syrah / Shiraz']
464;Bira Wines, Brunetto, Uco Valley, Mendoza, Argentina, 2018;Bira Wines;Brunetto;2018;Still;Red;Argentina;Mendoza;Uco Valley;Dry;Cork;14.00%;Medium;Oaked;['20% Merlot', '70% Sangiovese', '10% Syrah / Shiraz']
465;Viña Cobos, Volturno, Perdriel, Mendoza, Argentina, 2017;Viña Cobos;Volturno;2017;Still;Red;Argentina;Mendoza;Perdriel;Dry;;14.00%;;;['Cabernet Franc', 'Cabernet Sauvignon', 'Malbec']
466;Zuccardi, Tito Zuccardi, Uco Valley, Paraje Altamira, 2018;Zuccardi;Tito Zuccardi;2018;Still;Red;Argentina;Mendoza;Uco Valley;Dry;;14.60%;;;['Cabernet Franc', 'Malbec']
467;Riccitelli, Riccitelli & Father, Mendoza, Argentina, 2017;Riccitelli;Riccitelli & Father;2017;Still;Red;Argentina;Mendoza;;Dry;;14.50%;;;['Cabernet Franc', 'Malbec']
468;Francisco Puga y Familia, L’Amitié Grand Vin, Calchaqui, Salta, Argentina, 2018;Francisco Puga y Familia;L’Amitié Grand Vin;2018;Still;Red;Argentina;Salta;Calchaquí Valley;Dry;;14.10%;;;['Cabernet Franc', 'Malbec', 'Merlot']
469;Ver Sacrum, GSM, Uco Valley, Los Chacayes, Mendoza, 2017;Ver Sacrum;GSM;2017;Still;Red;Argentina;Mendoza;Uco Valley;Dry;;13.30%;;;['Mourvèdre', 'Syrah / Shiraz', 'Grenache']
470;Pulenta Estate, Gran Corte VII, Luján de Cuyo, 2017;Pulenta Estate;Gran Corte VII;2017;Still;Red;Argentina;Mendoza;Luján de Cuyo;Dry;;14.50%;;;['Cabernet Sauvignon', 'Malbec', 'Merlot']
471;Norton, Gernot Langes, Luján de Cuyo, Mendoza, 2016;Norton;Gernot Langes;2016;Still;Red;Argentina;Mendoza;Luján de Cuyo;Dry;;14.90%;;;['Cabernet Franc', 'Cabernet Sauvignon', 'Malbec']
472;Doña Paula, Altitude 1350, Uco Valley, Mendoza, 2017;Doña Paula;Altitude 1350;2017;Still;Red;Argentina;Mendoza;Uco Valley;Dry;;14.00%;;;['Cabernet Franc', 'Malbec']
473;PerSe, La Craie, Gualtallary, Tupungato, Mendoza, 2017;PerSe;La Craie;2017;Still;Red;Argentina;Gualtallary, Tupungato;;Dry;Cork;14.50%;Medium;Lightly Oaked;['14% Cabernet Franc', '86% Malbec']
474;PerSe, Iubileus, Gualtallary, Tupungato, Mendoza, 2015;PerSe;Iubileus;2015;Still;Red;Argentina;Gualtallary, Tupungato;;Dry;Cork;14.50%;Medium;Lightly Oaked;['3% Cabernet Franc', '97% Malbec']
475;PerSe, Inseparable, Gualtallary, Tupungato, Mendoza, 2018;PerSe;Inseparable;2018;Still;Red;Argentina;Gualtallary, Tupungato;;Dry;Cork;14.00%;Medium;Lightly Oaked;['100% Malbec']
476;PerSe, Volare del Camino, Gualtallary, Tupungato, 2016;PerSe;Volare del Camino;2016;Still;Red;Argentina;Gualtallary, Tupungato;;Dry;Cork;14.50%;Medium;Lightly Oaked;['100% Malbec']
477;Pulenta Estate, La Flor Malbec, Mendoza, Argentina, 2018;Pulenta Estate;La Flor Malbec;2018;Still;Red;Argentina;Mendoza;;Dry;;14.00%;;Oaked;['100% Malbec']
478;Terrazas de los Andes, Reserva Malbec, Mendoza, 2017;Terrazas de los Andes;Reserva Malbec;2017;Still;Red;Argentina;Mendoza;;Dry;Cork;14.00%;Full;Oaked;['100% Malbec']
479;Catena, DV Catena, Mendoza, Argentina, 2018;Catena;DV Catena;2018;Still;Red;Argentina;Mendoza;;Dry;Cork;13.50%;Full;Oaked;['100% Malbec']
480;Bodegas Salentein, Barrel Selection Malbec, Uco Valley;Bodegas Salentein;Barrel Selection Malbec;2018;Still;Red;Argentina;Uco Valley;Uco Valley;Dry;Cork;14.00%;Full;Oaked;['100% Malbec']
481;Cadus, Single Vineyard Finca Las Torcazas Malbec, Luján de Cuyo, Argentina, 2016;Cadus;Single Vineyard Finca Las Torcazas Malbec;2016;Still;Red;Argentina;Mendoza;Luján de Cuyo;Dry;;14.00%;;;['Malbec']
482;Viña Cobos, Bramare Marchiori Estate Malbec, Luján de Cuyo 2016;Viña Cobos;Bramare Marchiori Estate Malbec;2016;Still;Red;Argentina;Mendoza;Luján de Cuyo;Dry;Natural Cork;14.00%;Full;Oaked;['100% Malbec']
483;Altos Las Hormigas, Gualtallary Malbec, Uco Valley, 2014;Altos Las Hormigas;Gualtallary Malbec;2014;Still;Red;Argentina;Uco Valley;Uco Valley;Dry;Cork;14.50%;Full;;['Malbec']
484;Doña Paula, 1350, Uco Valley, Gualtallary, Mendoza, 2017;Doña Paula;1350;2017;Still;Red;Argentina;Mendoza;Uco Valley;Dry;;14.00%;;;['Cabernet Franc', 'Merlot']
485;Zuccardi, Q Tempranillo, Mendoza, Argentina, 2014;Zuccardi;Q Tempranillo;2014;Still;Red;Argentina;Mendoza;;Dry;Cork;14.00%;Full;Oaked;['100% Tempranillo']
486;Catena, Finest The Trilogy Malbec, Mendoza, Argentina, 2017;Catena;Finest The Trilogy Malbec;2017;Still;Red;Argentina;Mendoza;;Dry;Cork;13.50%;;;['Malbec']
487;Familia Cassone, Obra Prima Malbec, Luján de Cuyo, 2015;Familia Cassone;Obra Prima Malbec;2015;Still;Red;Argentina;Mendoza;Luján de Cuyo;Dry;;14.50%;;;['Malbec']
488;Andeluna, Altitud Malbec, Uco Valley, Mendoza, 2016;Andeluna;Altitud Malbec;2016;Still;Red;Argentina;Mendoza;Uco Valley;Dry;;14.00%;;;['Malbec']
489;Terrazas de los Andes, Parcel No10W Los Cerezos Malbec, Las Compuertas, Argentina, 2017;Terrazas de los Andes;Parcel No10W Los Cerezos Malbec;2017;Still;Red;Argentina;Mendoza;Las Compuertas;Dry;;13.70%;;;['Malbec']
490;Durigutti, Proyecto Las Compuertas Malbec 1914, Las Compuertas, Argentina, 2017;Durigutti;Proyecto Las Compuertas Malbec 1914;2017;Still;Red;Argentina;Mendoza;Las Compuertas;Dry;;13.50%;;;['25% Cabernet Franc', '45% Malbec']
491;Casarena, Owen’s Vineyard Cabernet Sauvignon, Luján de Cuyo, Argentina, 2017;Casarena;Owen’s Vineyard Cabernet Sauvignon;2017;Still;Red;Argentina;Mendoza;Luján de Cuyo;Dry;;14.00%;;;['Cabernet Sauvignon']
492;Finca Adalgisa, Malbec, Luján de Cuyo, Mendoza, 2013;Finca Adalgisa;Malbec;2013;Still;Red;Argentina;Mendoza;Luján de Cuyo;Dry;;14.20%;;;['Malbec']
493;Mendel, La Primera Revancha Chenin Blanc, Luján de Cuyo, Argentina, 2019;Mendel;La Primera Revancha Chenin Blanc;2019;Still;White;Argentina;Mendoza;Luján de Cuyo;Dry;;13.70%;;;['Chenin Blanc']
494;Malbec de Angeles, Gran Corte Viña 1924, Luján de Cuyo, Argentina, 2016;Malbec de Angeles;Gran Corte Viña 1924;2016;Still;Red;Argentina;Mendoza;Luján de Cuyo;Dry;;14.50%;;;['30% Cabernet Sauvignon', '70% Malbec']
495;Colonia Las Liebres, Cabernet Franc, Luján de Cuyo, 2019;Colonia Las Liebres;Cabernet Franc;2019;Still;Red;Argentina;;;;;;;;
496;Susana Balbo, Brioso, Luján de Cuyo, Agrelo, Mendoza, 2018;Susana Balbo;Brioso;2018;Still;Red;Argentina;Mendoza;Luján de Cuyo;Dry;;14.50%;;;['Cabernet Sauvignon']
497;Viña Cobos, Bramare Marchiori Vineyard Malbec, Perdriel, Argentina, 2017;Viña Cobos;Bramare Marchiori Vineyard Malbec;2017;Still;Red;Argentina;Mendoza;Perdriel;Dry;;14.00%;;;['Malbec']
498;Bodega Argento, Artesano de Argento Organic Malbec, Luján de Cuyo, Argentina, 2018;Bodega Argento;Artesano de Argento Organic Malbec;2018;Still;Red;Argentina;Mendoza;Luján de Cuyo;Dry;;14.50%;;;['Cabernet Franc', 'Malbec']
499;Doña Paula, 969, Ugarteche, Mendoza, Argentina, 2019;Doña Paula;969;2019;Still;Red;Argentina;Mendoza;Ugarteche;Dry;;13.50%;;;['40% Bonarda', '55% Petit Verdot', '5% Tannat']
500;Argento, Artesano de Argento Organic Malbec-Cabernet Franc;Argento;Artesano de Argento Organic Malbec-Cabernet Franc;2018;Still;Red;Argentina;Mendoza;;Dry;Cork;14.50%;Medium;Lightly Oaked;['30% Cabernet Franc', '70% Malbec']
501;Bodega Ruca Malen, Terroir Series Petit Verdot, Luján de;Bodega Ruca Malen;Terroir Series Petit Verdot;2017;Still;Red;Argentina;Luján de Cuyo;Luján de Cuyo;Dry;Cork;14.00%;Full;Oaked;['100% Petit Verdot']
502;Chakana, Nuna Vineyard Rosé, Luján de Cuyo, Agrelo, 2019;Chakana;Nuna Vineyard Rosé;2019;Still;Rosé;Argentina;Luján de Cuyo;Luján de Cuyo;Dry;Screwcap;12.50%;Light;Unoaked;['34% Malbec', '47% Syrah / Shiraz', '19% Tannat']
503;Altos Las Hormigas, Mendoza Malbec Clásico, Luján de Cuyo;Altos Las Hormigas;Mendoza Malbec Clásico;2018;Still;Red;Argentina;Luján de Cuyo;Luján de Cuyo;Dry;Cork;13.50%;Medium;Unoaked;['100% Malbec']
504;Estancia Mendoza, Malbec Reserve, Uco Valley, 2019;Estancia Mendoza;Malbec Reserve;2019;Still;Red;Argentina;Uco Valley;Uco Valley;Dry;Cork;14.00%;Full;Lightly Oaked;['100% Malbec']
505;Estancia Mendoza, Estate Malbec-Cabernet Franc, Uco Valley;Estancia Mendoza;Estate Malbec-Cabernet Franc;2019;Still;Red;Argentina;Uco Valley;Uco Valley;Dry;Cork;13.50%;Full;Oaked;['45% Cabernet Franc', '55% Malbec']
506;Estancia Mendoza, Estate Malbec, Uco Valley, 2019;Estancia Mendoza;Estate Malbec;2019;Still;Red;Argentina;Uco Valley;Uco Valley;Dry;Cork;13.50%;Full;Lightly Oaked;['100% Malbec']
507;Familia Falasco, Hermandad Single Vineyard Chardonnay, Uco Valley, 2017;Familia Falasco;Hermandad Single Vineyard Chardonnay;2017;Still;White;Argentina;Mendoza;Uco Valley;Dry;;13.00%;;;['100% Chardonnay']
508;Bodega Atamisque, Catalpa Single Vineyard Chardonnay, Uco Valley, 2018;Bodega Atamisque;Catalpa Single Vineyard Chardonnay;2018;Still;White;Argentina;Mendoza;Uco Valley;Dry;;14.00%;;;['100% Chardonnay']
509;Finca Flichman, Dedicado Tupungato Vineyard Chardonnay, Uco Valley, 2017;Finca Flichman;Dedicado Tupungato Vineyard Chardonnay;2017;Still;White;Argentina;Mendoza;Uco Valley;Dry;;13.00%;Medium;;['100% Chardonnay']
510;Terrazas de los Andes, Reserva Chardonnay, Uco Valley, 2018;Terrazas de los Andes;Reserva Chardonnay;2018;Still;White;Argentina;Mendoza;Uco Valley;Dry;;14.00%;;;['100% Chardonnay']
511;Zuccardi, Apelación Tupungato Chardonnay, Uco Valley, 2018;Zuccardi;Apelación Tupungato Chardonnay;2018;Still;White;Argentina;Mendoza;Uco Valley;Dry;;13.50%;;;['100% Chardonnay']
512;Familia Schroeder, Alpataco Chardonnay, Patagonia, 2018;Familia Schroeder;Alpataco Chardonnay;2018;Still;White;Argentina;Patagonia;;Dry;;13.00%;;;['100% Chardonnay']
513;Bodega Atamisque, Catalpa Assemblage, Uco Valley, Tupungato;Bodega Atamisque;Catalpa Assemblage;2016;Still;Red;Argentina;Mendoza;Uco Valley;Dry;;14.00%;;;['Cabernet Franc', 'Cabernet Sauvignon', 'Malbec']
514;Terrazas de los Andes, Reserva Torrontes, Salta, 2017;Terrazas de los Andes;Reserva Torrontes;2017;Still;White;Argentina;Salta;;Dry;Screwcap;13.50%;Light;Unoaked;['100% Torrontés']
515;Terrazas de los Andes, Reserva Malbec, Mendoza, 2016;Terrazas de los Andes;Reserva Malbec;2016;Still;Red;Argentina;Mendoza;;Dry;Cork;14.50%;Full;Oaked;['100% Malbec']
516;Terrazas de los Andes, Grand Cabernet Sauvignon, 2017;Terrazas de los Andes;Grand Cabernet Sauvignon;2017;Still;Red;Argentina;Mendoza;;Dry;Cork;14.00%;Full;Oaked;['100% Cabernet Sauvignon']
517;Zuccardi, Q Tempranillo, Mendoza, Argentina, 2013;Zuccardi;Q Tempranillo;2013;Still;Red;Argentina;Mendoza;;Dry;;14.50%;;;['100% Tempranillo']
518;Nieto Senetiner, Bonarda, Mendoza, Argentina, 2015;Nieto Senetiner;Bonarda;2015;;Red;Argentina;Mendoza;;;;13.00%;;;['Bonarda']
519;Trivento, Golden Reserve Malbec, Luján de Cuyo, 2017;Trivento;Golden Reserve Malbec;2017;Still;Red;Argentina;Mendoza;Luján de Cuyo;Dry;Cork;14.00%;Medium;Oaked;['100% Malbec']
520;Catena Zapata, Nicolas Catena Zapata, Luján de Cuyo, 2013;Catena Zapata;Nicolas Catena Zapata;2013;Still;Red;Argentina;Mendoza;Luján de Cuyo;Dry;Natural Cork;13.50%;Full;Oaked;['75% Cabernet Sauvignon', '25% Malbec']
521;Susana Balbo, Mandala Collection Cabernet Sauvignon (Vista Flores), Tunuyán, Uco Valley 2011;Susana Balbo;Mandala Collection (Vista Flores);2011;Still;Red;Argentina;Mendoza;Uco Valley;Dry;;14.00%;Full;Oaked;['Cabernet Sauvignon']
522;Bodega Colomé, Malbec, Salta, Argentina, 2017;Bodega Colomé;Malbec;2017;Still;Red;Argentina;Salta;;Dry;Cork;;Full;Oaked;['Cabernet Sauvignon', 'Malbec', 'Tannat']
523;55 Malbec, Toko Vineyard Red Blend, Zaha, Uco Valley, La;55 Malbec;Zaha;2012;;Red;Argentina;Uco Valley;Uco Valley;;;14.00%;;;['Malbec']
524;Bodegas El Esteco, Altimus, Michel Torino Estate, Cafayate, Calchaqui Valley 2011;El Esteco;Altimus;2011;;Red;Argentina;Calchaquí Valley;;;;15.00%;;;['Cabernet Franc', 'Cabernet Sauvignon', 'Malbec']
525;Chakana, Estate Selection Red Blend, Uco Valley, 2017;Chakana;Estate Selection Red Blend;2017;Still;Red;Argentina;Uco Valley;Uco Valley;Dry;Cork;14.00%;Full;Oaked;['5% Cabernet Franc', '25% Cabernet Sauvignon', '70% Malbec']
526;Sainsbury's, Taste the Difference Morador High Altitude Malbec, Argentina 2017;Sainsbury's;Taste the Difference Morador High Altitude Malbec;2017;Still;Red;Argentina;;;Dry;Cork;14.00%;Full;Lightly Oaked;['100% Malbec']
527;Amalaya, Tinto de Corte, Calchaquí Valley, Cafayate, 2013;Amalaya;Tinto de Corte;2013;;Red;Argentina;Calchaquí Valley;;;;14.00%;;;['Malbec', 'Syrah / Shiraz']
528;Luca, Laborde Double Select, La Consulta, Mendoza, Uco Valley 2013;Luca;Laborde Double Select;2013;;Red;Argentina;Uco Valley;Uco Valley;;;14.00%;;;['Syrah / Shiraz']
529;Tesco, Finest Angelica Sur Malbec, Uco Valley, Mendoza, 2016;Tesco;Finest Angelica Sur Malbec;2016;Still;Red;Argentina;Mendoza;Uco Valley;Dry;;13.50%;Medium;Oaked;['100% Malbec']
530;Tesco, The Finest Malbec, Mendoza, Argentina, 2018;Tesco;The Finest Malbec;2018;Still;Red;Argentina;Mendoza;;Dry;Screwcap;13.00%;Full;;['Malbec']
531;Bodega Colomé, Altitude Blend Malbec, Salta, Argentina, 2017;Bodega Colomé;Altitude Blend Malbec;2017;Still;Red;Argentina;Salta;;Dry;;14.50%;Full;Oaked;['5% Cabernet Franc', '85% Malbec', '10% Tannat']
532;Bodega Atamisque, Serbal Malbec, Uco Valley, Tupungato, 2015;Bodega Atamisque;Serbal Malbec;2015;Still;Red;Argentina;Mendoza;Uco Valley;;;14.00%;;;['100% Malbec']
533;Viña Cobos, Bramare Appellation Malbec, Luján de Cuyo, 2017;Viña Cobos;Bramare Appellation Malbec;2017;Still;Red;Argentina;Mendoza;Luján de Cuyo;Dry;Natural Cork;14.50%;Full;Oaked;['100% Malbec']
534;Viña Cobos, Volturno Cabernet Malbec, Luján de Cuyo, 2010;Viña Cobos;Volturno Cabernet Malbec;2010;Still;Red;Argentina;Mendoza;Luján de Cuyo;Dry;Natural Cork;15.50%;Full;Oaked;['77% Cabernet Sauvignon', '23% Malbec']
535;Viña Cobos, Volturno Cabernet Malbec, Luján de Cuyo, 2016;Viña Cobos;Volturno Cabernet Malbec;2016;Still;Red;Argentina;Mendoza;Luján de Cuyo;Dry;Natural Cork;14.50%;Full;Oaked;['95% Cabernet Sauvignon', '5% Malbec']
