;Title;Producer;Brand;Vintage;Wine Type;Colour;Country;Region;Appellation;Sweetness;Closure;Alcohol;Body;Oak;Grapes
268;Bodega Tacuil, Unoak Malbec, Calchaquí Valley, Salta, 2018;Bodega Tacuil;Unoak Malbec;2018;Still;Red;Argentina;Salta;Calchaquí Valley;Dry;Cork;14.50%;Full;Oaked;['100% Malbec']
269;La Celia, Paraje Altamira Malbec, Uco Valley, Paraje Altamira, 2017;La Celia;Paraje Altamira Malbec;2017;Still;Red;Argentina;Mendoza;Uco Valley;Dry;Cork;14.00%;Full;Oaked;['100% Malbec']
270;Agustín Lanús, Sunal Ilógico Malbec, Calchaquí Valley, 2018;Agustín Lanús;Sunal Ilógico Malbec;2018;Still;Red;Argentina;Salta;Calchaquí Valley;Dry;Cork;14.50%;Full;Oaked;['100% Malbec']
271;Escorihuela Gascón, Single Vineyard Malbec, Uco Valley, 2019;Escorihuela Gascón;Single Vineyard Malbec;2019;Still;Red;Argentina;Mendoza;Uco Valley;Dry;Cork;13.50%;Full;Oaked;['100% Malbec']
272;El Esteco, Fincas Notables, Calchaquí Valley, Salta, 2017;El Esteco;Fincas Notables;2017;Still;Red;Argentina;Salta;Calchaquí Valley;Dry;Cork;14.50%;Full;Oaked;['100% Malbec']
273;Carelli, Malbec Gran Reserva, Mendoza, Argentina, 2013;Carelli;Malbec Gran Reserva;2013;Still;Red;Argentina;Mendoza;;Dry;Cork;14.50%;Full;Oaked;['100% Malbec']
274;Bressia, Monteagrelo Malbec, Luján de Cuyo, Mendoza, 2018;Bressia;Monteagrelo Malbec;2018;Still;Red;Argentina;Mendoza;Luján de Cuyo;Dry;Cork;14.50%;Full;Oaked;['100% Malbec']
275;Alpamanta, Terroir Single Vineyard Malbec, Luján de Cuyo, 2014;Alpamanta;Terroir Single Vineyard Malbec;2014;Still;Red;Argentina;Mendoza;Luján de Cuyo;Dry;Cork;15.50%;Full;Oaked;['100% Malbec']
276;Viñalba, Gran Reservado Malbec, Uco Valley, Mendoza, 2018;Viñalba;Gran Reservado Malbec;2018;Still;Red;Argentina;Mendoza;Uco Valley;Dry;Cork;14.50%;Full;Oaked;['100% Malbec']
277;Familia Falasco, Hermandad Single Vineyard Malbec, Uco Valley, 2018;Familia Falasco;Hermandad Single Vineyard Malbec;2018;Still;Red;Argentina;Mendoza;Uco Valley;Dry;Cork;14.50%;Full;Oaked;['100% Malbec']
278;Abremundos, Octava Bassa, Uco Valley, Mendoza, 2017;Abremundos;Octava Bassa;2017;Still;Red;Argentina;Mendoza;Uco Valley;Dry;Cork;14.50%;Full;Oaked;['100% Malbec']
279;Trapiche, Terroir Series Finca Coletto Single Vineyard, El Peral, Uco Valley, Tupungato, 2017;Trapiche;Terroir Series Finca Coletto Single Vineyard, El Peral;2017;Still;Red;Argentina;Mendoza;Uco Valley;Dry;Cork;14.50%;Full;Oaked;['100% Malbec']
280;Melipal, Nazarenas Malbec, Luján de Cuyo, Agrelo, 2016;Melipal;Nazarenas Malbec;2016;Still;Red;Argentina;Mendoza;Luján de Cuyo;Dry;Cork;14.50%;Full;Oaked;['100% Malbec']
281;Riglos, Quinto Malbec, Uco Valley, Gualtallary, 2019;Riglos;Quinto Malbec;2019;Still;Red;Argentina;Mendoza;Uco Valley;Dry;Cork;14.50%;Full;Oaked;['100% Malbec']
282;Vinos De Potrero, Gran Malbec de Potrero, Uco Valley, 2016;Vinos De Potrero;Gran Malbec de Potrero;2016;Still;Red;Argentina;Mendoza;Uco Valley;Dry;Cork;14.00%;Full;Oaked;['100% Malbec']
283;Luigi Bosca, Malbec Selección de Vistalba, Luján de Cuyo, Vistalba, 2019;Luigi Bosca;Malbec Selección de Vistalba;2019;Still;Red;Argentina;Mendoza;Luján de Cuyo;Dry;Cork;14.00%;Full;Oaked;['100% Malbec']
284;El Porvenir de Cafayate, Laborum Single Vineyard Malbec, Cafayate Valley, 2018;El Porvenir de Cafayate;Laborum Single Vineyard Malbec;2018;Still;Red;Argentina;Salta;Cafayate Valley;Dry;Cork;14.50%;Full;Oaked;['100% Malbec']
285;Luna Austral, Malbec, Uco Valley, Mendoza, Argentina, 2016;Luna Austral;Malbec;2016;Still;Red;Argentina;Mendoza;Uco Valley;Dry;Cork;14.50%;Full;Oaked;['100% Malbec']
286;Manos Negras, Malbec Stone Soil, Uco Valley, Mendoza, 2018;Manos Negras;Malbec Stone Soil;2018;Still;Red;Argentina;Mendoza;Uco Valley;Dry;Cork;14.00%;Full;Oaked;['100% Malbec']
287;Finca Sophenia, Synthesis Malbec, Uco Valley, Gualtallary, 2019;Finca Sophenia;Synthesis Malbec;2019;Still;Red;Argentina;Mendoza;Uco Valley;Dry;Cork;14.50%;Full;Oaked;['100% Malbec']
288;Penedo Borges, Selección de Parcelas Single Vineyard Malbec, Luján de Cuyo, Agrelo, 2018;Penedo Borges;Selección de Parcelas Single Vineyard Malbec;2018;Still;Red;Argentina;Mendoza;Luján de Cuyo;Dry;Cork;15.30%;Full;Oaked;['100% Malbec']
289;Lupa, Malbec, Uco Valley, Paraje Altamira, Mendoza, 2016;Lupa;Malbec;2016;Still;Red;Argentina;Mendoza;Uco Valley;Dry;Cork;14.00%;Full;Oaked;['100% Malbec']
290;Finca Suarez, Malbec, Uco Valley, Paraje Altamira, 2017;Finca Suarez;Malbec;2017;Still;Red;Argentina;Mendoza;Uco Valley;Dry;Cork;14.00%;Full;Oaked;['100% Malbec']
291;Zorzal, Eggo Tinto de Tiza Malbec, Uco Valley, Tupungato, 2017;Zorzal;Eggo Tinto de Tiza Malbec;2017;Still;Red;Argentina;Mendoza;Uco Valley;Dry;Cork;13.50%;Full;Oaked;['100% Malbec']
292;Nieto Senetiner, Don Nicanor Malbec, Luján de Cuyo, 2018;Nieto Senetiner;Don Nicanor Malbec;2018;Still;Red;Argentina;Mendoza;Luján de Cuyo;Dry;Cork;15.00%;Full;Oaked;['100% Malbec']
293;Finca Flichman, Dedicado Tupungato Vineyard, Uco Valley, 2016;Finca Flichman;Dedicado Tupungato Vineyard;2016;Still;Red;Argentina;Mendoza;Uco Valley;Dry;Cork;13.50%;Full;Oaked;['100% Malbec']
294;Bodega 40/40, Cuarenta Malbec, Luján de Cuyo, Mendoza, 2018;Bodega 40/40;Cuarenta Malbec;2018;Still;Red;Argentina;Mendoza;Luján de Cuyo;Dry;Cork;14.00%;Full;Oaked;['100% Malbec']
295;Don Cristobal, Cristóbal Barrel Selection, Luján de Cuyo, 2018;Don Cristobal;Cristóbal Barrel Selection;2018;Still;Red;Argentina;Mendoza;Luján de Cuyo;Dry;Cork;14.50%;Full;Oaked;['100% Malbec']
296;Zuccardi, Concreto Malbec, Uco Valley, Paraje Altamira, 2020;Zuccardi;Concreto Malbec;2020;Still;Red;Argentina;Mendoza;Uco Valley;Dry;Cork;13.50%;Full;Oaked;['100% Malbec']
297;Anima Mundi, CAT Las Pintadas Malbec, Uco Valley, Tunuyán, 2017;Anima Mundi;CAT Las Pintadas Malbec;2017;Still;Red;Argentina;Mendoza;Uco Valley;Dry;Cork;14.50%;Full;Oaked;['100% Malbec']
298;Viña Cobos, Bramare Malbec, Luján de Cuyo, Mendoza, 2018;Viña Cobos;Bramare Malbec;2018;Still;Red;Argentina;Mendoza;Luján de Cuyo;Dry;Cork;14.50%;Full;Oaked;['100% Malbec']
299;Vicentin, Blend De Malbecs, Uco Valley, Tupungato, 2018;Vicentin;Blend De Malbecs;2018;Still;Red;Argentina;Mendoza;Uco Valley;Dry;Cork;15.00%;Full;Oaked;['100% Malbec']
300;Tapiz, Black Tears - San Pablo Estate Vineyard, Uco Valley, 2015;Tapiz;Black Tears - San Pablo Estate Vineyard;2015;Still;Red;Argentina;Mendoza;Uco Valley;Dry;Cork;14.80%;Full;Oaked;['100% Malbec']
301;MAAL, Biutiful, Campo los Andes, Uco Valley, Tunuyán, 2019;MAAL;Biutiful, Campo los Andes;2019;Still;Red;Argentina;Mendoza;Uco Valley;Dry;Cork;14.50%;Full;Oaked;['100% Malbec']
302;Susana Balbo, BenMarco Malbec, Uco Valley, Los Chacayes, 2018;Susana Balbo;BenMarco Malbec;2018;Still;Red;Argentina;Mendoza;Uco Valley;Dry;Cork;14.50%;Full;Oaked;['100% Malbec']
303;Antucura, Barrandica Malbec, Uco Valley, Vista Flores, 2020;Antucura;Barrandica Malbec;2020;Still;Red;Argentina;Mendoza;Uco Valley;Dry;Cork;14.50%;Full;Oaked;['100% Malbec']
304;Chakana, Ayni, Uco Valley, Paraje Altamira, Mendoza, 2019;Chakana;Ayni;2019;Still;Red;Argentina;Mendoza;Uco Valley;Dry;Cork;14.00%;Full;Oaked;['100% Malbec']
305;Bodega Colomé, Auténtico Malbec, Calchaquí Valley, 2019;Bodega Colomé;Auténtico Malbec;2019;Still;Red;Argentina;Salta;Calchaquí Valley;Dry;Cork;14.50%;Full;Oaked;['100% Malbec']
306;Bodegas Caro, Aruma, Uco Valley, Mendoza, Argentina, 2019;Bodegas Caro;Aruma;2019;Still;Red;Argentina;Mendoza;Uco Valley;Dry;Cork;14.50%;Full;Oaked;['100% Malbec']
307;Pyros Wines, Appellation Malbec, Pedernal Valley, 2018;Pyros Wines;Appellation Malbec;2018;Still;Red;Argentina;San Juan;Pedernal Valley;Dry;Cork;14.50%;Full;Oaked;['100% Malbec']
308;Altos Las Hormigas, Appellation Gualtallary, Uco Valley, 2018;Altos Las Hormigas;Appellation Gualtallary;2018;Still;Red;Argentina;Mendoza;Uco Valley;Dry;Cork;13.50%;Full;Oaked;['100% Malbec']
309;Matervini, Antes Andes Viña Canota, Canota Valley, 2017;Matervini;Antes Andes Viña Canota;2017;Still;Red;Argentina;Mendoza;Canota Valley;Dry;Cork;14.50%;Full;Oaked;['100% Malbec']
310;Domaine Bousquet, Ameri Single Vineyard Malbec, Gualtallary, Uco Valley, 2019;Domaine Bousquet;Ameri Single Vineyard Malbec;2019;Still;Red;Argentina;Mendoza;Uco Valley;Dry;Cork;14.50%;Full;Oaked;['100% Malbec']
311;Bodega Norton, Altura Malbec, Uco Valley, Mendoza, 2019;Bodega Norton;Altura Malbec;2019;Still;Red;Argentina;Mendoza;Uco Valley;Dry;Cork;14.50%;Full;Oaked;['100% Malbec']
312;Karim Mussi, Altocedro Reserve Old Vine Malbec, Luján de Cuyo, 2018;Karim Mussi;Altocedro Reserve Old Vine Malbec;2018;Still;Red;Argentina;Mendoza;Luján de Cuyo;Dry;Cork;14.50%;Full;Oaked;['100% Malbec']
313;Finca Eugenio Bustos, Altivo Secret Single Vineyard Malbec, Uco Valley, 2014;Finca Eugenio Bustos;Altivo Secret Single Vineyard Malbec;2014;Still;Red;Argentina;Mendoza;Uco Valley;Dry;Cork;14.80%;Full;Oaked;['100% Malbec']
314;Sur Andino, Altaluvia Malbec, Uco Valley, Gualtallary, 2018;Sur Andino;Altaluvia Malbec;2018;Still;Red;Argentina;Mendoza;Uco Valley;Dry;Cork;14.50%;Full;Oaked;['100% Malbec']
315;Familia Goyenechea, 5ta Generacion Malbec, Mendoza, 2015;Familia Goyenechea;5ta Generacion Malbec;2015;Still;Red;Argentina;Mendoza;;Dry;Cork;13.50%;Full;Oaked;['100% Malbec']
316;Bodegas Salentein, Primus, Uco Valley, Mendoza, 2016;Bodegas Salentein;Primus;2016;Still;Red;Argentina;Mendoza;Uco Valley;Dry;Natural Cork;13.50%;Full;Oaked;['100% Cabernet Sauvignon']
317;Catena Zapata, Nicolás Catena Zapata, Mendoza, 2016;Catena Zapata;Nicolás Catena Zapata;2016;Still;Red;Argentina;Mendoza;;Dry;;13.50%;;;['Cabernet Franc', 'Cabernet Sauvignon', 'Malbec']
318;Bodega Trapiche, Terroir Series Finca Laborde Cabernet Sauvignon, La Consulta, 2017;Bodega Trapiche;Terroir Series Finca Laborde Cabernet Sauvignon;2017;Still;Red;Argentina;Mendoza;Uco Valley;Dry;Natural Cork;14.50%;Full;Oaked;['100% Cabernet Sauvignon']
319;Viña Cobos, Volturno, Mendoza, Argentina, 2018;Viña Cobos;Volturno;2018;Still;Red;Argentina;Mendoza;;Dry;Natural Cork;14.50%;Full;Oaked;['1% Cabernet Franc', '88% Cabernet Sauvignon', '11% Malbec']
320;Bemberg, La Linterna Parcela nº19 Las Mercedes, Cafayate Valley, Salta, 2016;Bemberg;La Linterna Parcela nº19 Las Mercedes;2016;Still;Red;Argentina;Salta;Cafayate Valley;Dry;Natural Cork;14.50%;Full;Oaked;['100% Cabernet Sauvignon']
321;Terrazas de los Andes, Grand Cabernet Sauvignon, Mendoza, 2018;Terrazas de los Andes;Grand Cabernet Sauvignon;2018;Still;Red;Argentina;Mendoza;;Dry;Natural Cork;14.00%;Full;Oaked;['100% Cabernet Sauvignon']
322;Zuccardi, Finca Los Membrillos, La Consulta, Mendoza, 2018;Zuccardi;Finca Los Membrillos;2018;Still;Red;Argentina;Mendoza;Uco Valley;Dry;Natural Cork;14.50%;Full;Oaked;['100% Cabernet Sauvignon']
323;Bodega Noemia, Due, Río Negro, Mainqué, Patagonia, 2017;Bodega Noemia;Due;2017;Still;Red;Argentina;;;;;;;;
324;Rutini, Apartado Gran Cabernet Sauvignon, Uco Valley, Mendoza, Argentina, 2015;Rutini;Apartado Gran Cabernet Sauvignon;2015;Still;Red;Argentina;Mendoza;Uco Valley;Dry;Other;14.30%;Full;Oaked;['100% Cabernet Sauvignon']
325;Zuccardi, Los Olivos Chardonnay, Mendoza, Argentina, 2019;Zuccardi;Los Olivos Chardonnay;2019;Still;White;Argentina;Mendoza;;Dry;Screwcap;13.50%;Light;Lightly Oaked;['100% Chardonnay']
326;Alamos, Malbec Rosé, Uco Valley, Mendoza, Argentina, 2020;Alamos;Malbec Rosé;2020;Still;Rosé;Argentina;Mendoza;Uco Valley;Dry;Screwcap;13.50%;Light;Unoaked;['100% Malbec']
327;Trivento, Malbec Private Reserve, Mendoza, Argentina, 2020;Trivento;Malbec Private Reserve;2020;Still;Red;Argentina;Mendoza;;Dry;Screwcap;14.00%;Medium;Oaked;['100% Malbec']
328;Rutas de Cafayate, Malbec Elegante, Cafayate, Salta, 2020;Rutas de Cafayate;Malbec Elegante;2020;Still;Red;Argentina;Cafayate;;Dry;Cork;13.00%;Medium;Oaked;['100% Malbec']
329;Catena, Malbec, Mendoza, Argentina, 2018;Catena;Malbec;2018;Still;Red;Argentina;Mendoza;;Dry;Cork;13.50%;Full;Oaked;['100% Malbec']
330;Doña Paula, Blue Edition Velvet Blend, Luján de Cuyo, 2018;Doña Paula;Blue Edition Velvet Blend;2018;Still;Red;Argentina;Mendoza;Luján de Cuyo;Dry;Cork;13.50%;Medium;Oaked;['10% Bonarda', '60% Malbec', '30% Pinot Noir / Pinot Nero']
331;Doña Paula, Sauvignon Blanc, Uco Valley, Gualtallary, 2018;Doña Paula;Sauvignon Blanc;2018;Still;White;Argentina;Mendoza;Uco Valley;Dry;Screwcap;12.00%;Light;Unoaked;['100% Sauvignon Blanc']
332;Catena, Chardonnay, Mendoza, Argentina, 2019;Catena;Chardonnay;2019;Still;White;Argentina;Mendoza;;Dry;Cork;13.50%;Light;Lightly Oaked;['100% Chardonnay']
333;Bodega Trapiche, Pure Malbec, Uco Valley, Mendoza, 2020;Bodega Trapiche;Pure Malbec;2020;Still;Red;Argentina;Mendoza;Uco Valley;Dry;Cork;13.50%;Medium;Unoaked;['100% Malbec']
334;Bodega Trapiche, Costa & Pampa Chardonnay, Chapadmalal, 2020;Bodega Trapiche;Costa & Pampa Chardonnay;2020;Still;White;Argentina;Buenos Aires;Chapadmalal;Dry;Cork;12.50%;Light;Lightly Oaked;['100% Chardonnay']
335;Susana Balbo, Tradición Malbec, Mendoza, Argentina 2020;Susana Balbo;Tradición Malbec;2020;Still;Red;Argentina;Mendoza;;Dry;Screwcap;14.50%;Full;;['100% Malbec']
336;Buenas Vides, Shiraz, San Juan, Argentina 2019;Buenas Vides;Shiraz;2019;Still;Red;Argentina;San Juan;;Dry;;12.50%;;;['100% Syrah / Shiraz']
337;Aldi, Specially Selected Malbec Rosé, Uco Valley, Argentina 2019;Aldi;Buenas Vidas Specially Selected Malbec Rosé;2019;Still;Rosé;Argentina;Uco Valley;;Dry;Screwcap;13.00%;Medium;Unoaked;['100% Malbec']
338;Aldi, Specially Selected Organic Malbec, Mendoza, Argentina 2020;Aldi;Specially Selected Organic Malbec;2020;Still;Red;Argentina;Mendoza;;Dry;Screwcap;14.50%;Full;;['100% Malbec']
339;D.V. Catena, Chardonnay Historico, Mendoza, Argentina, 2019;D.V. Catena;Chardonnay Historico;2019;Still;White;Argentina;Mendoza;;Dry;Cork;13.50%;;;['100% Chardonnay']
340;Sainsbury's, Taste the Difference Morador Argentinian;Sainsbury's;Taste the Difference Morador Argentinian Cabernet Franc;2019;Still;Red;Argentina;Mendoza;Uco Valley;Dry;Cork;14.50%;Medium;Lightly Oaked;['100% Cabernet Franc']
341;Otronia, III&VI, Chubut, Patagonia, Argentina, 2018;Otronia;III&VI;2018;Still;White;Argentina;Patagonia;Chubut;Dry;;13.00%;;;['Chardonnay']
342;Bemberg, La Linterna, Gualtallary, Mendoza, Argentina, 2016;Bemberg;La Linterna;2016;Still;White;Argentina;Mendoza;Gualtallary;Dry;;14.00%;;;['Chardonnay']
343;Finca Sophenia, Reserve Chardonnay, Gualtallary, Argentina, 2020;Finca Sophenia;Reserve Chardonnay;2020;Still;White;Argentina;Mendoza;Gualtallary;Dry;;13.50%;;;['Chardonnay']
344;Domaine Bousquet, Reserve Chardonnay, Uco Valley, Tupungato, Argentina, 2020;Domaine Bousquet;Reserve Chardonnay;2020;Still;White;Argentina;Mendoza;Uco Valley;Dry;;14.50%;;;['Chardonnay']
345;Marcelo Pelleriti, Signature, Uco Valley, Mendoza, Argentina, 2017;Marcelo Pelleriti;Signature;2017;Still;White;Argentina;Mendoza;Uco Valley;Dry;;14.50%;;;['Chardonnay']
346;Cadus, Vista Flores, Mendoza, Argentina, 2019;Cadus;Vista Flores;2019;Still;White;Argentina;Mendoza;;Dry;;14.20%;;;['Chardonnay']
347;Sottano, María Magdalena, Gualtallary, Mendoza, Argentina, 2019;Sottano;María Magdalena;2019;Still;White;Argentina;Mendoza;Gualtallary;Dry;;14.10%;;;['Chardonnay']
348;Zuccardi, Fósil, Uco Valley, Mendoza, Argentina, 2020;Zuccardi;Fósil;2020;Still;White;Argentina;Mendoza;Uco Valley;Dry;;13.50%;;;['Chardonnay']
349;Viña Cobos, Felino, Luján de Cuyo, Mendoza, Argentina, 2018;Viña Cobos;Felino;2018;Still;White;Argentina;Mendoza;Luján de Cuyo;Dry;;14.50%;;;['Chardonnay']
350;Susana Balbo, Crios, Uco Valley, Mendoza, Argentina, 2020;Susana Balbo;Crios;2020;Still;White;Argentina;Mendoza;Uco Valley;Dry;;13.50%;;;['Chardonnay']
351;Altaluvia, Chardonnay, Gualtallary, Mendoza, Argentina, 2019;Altaluvia;Chardonnay;2019;Still;White;Argentina;Mendoza;Gualtallary;Dry;;13.50%;;;['Chardonnay']
352;Rutini, Chardonnay, Mendoza, Argentina, 2019;Rutini;Chardonnay;2019;Still;White;Argentina;Mendoza;;Dry;;14.00%;;;['Chardonnay']
353;Catena Zapata, Catena Alta Chardonnay, Gualtallary, Argentina, 2019;Catena Zapata;Catena Alta Chardonnay;2019;Still;White;Argentina;Mendoza;Gualtallary;Dry;;14.00%;;;['Chardonnay']
354;Bodega Atamisque, Catalpa, Uco Valley, Tupungato, Argentina, 2019;Bodega Atamisque;Catalpa;2019;Still;White;Argentina;Mendoza;Uco Valley;Dry;;14.00%;;;['Chardonnay']
355;Viña Cobos, Bramare Los Abolitos Vineyard, Uco Valley, Argentina, 2018;Viña Cobos;Bramare Los Abolitos Vineyard;2018;Still;White;;;;;;;;;
356;Zuccardi, Apelación Tupungato Chardonnay, Uco Valley, Mendoza, Argentina, 2020;Zuccardi;Apelación Tupungato Chardonnay;2020;Still;White;Argentina;Mendoza;Uco Valley;Dry;;13.50%;;;['Chardonnay']
357;Catena Zapata, Adrianna Vineyard White Stones, Gualtallary, Mendoza, Argentina, 2018;Catena Zapata;Adrianna Vineyard White Stones;2018;Still;White;Argentina;Mendoza;Gualtallary;Dry;;12.50%;;;['Chardonnay']
358;Finca La Igriega, Malbec, Paraje Altamira, Uco Valley, Mendoza, Argentina 2018;Finca La Igriega;Malbec;2018;Still;Red;Argentina;Mendoza;Uco Valley;Dry;Cork;14.00%;Full;Oaked;['100% Malbec']
359;Marks & Spencer, Found Cabernet Franc, Uco Valley, Mendoza, Argentina 2019;Marks & Spencer;Found Cabernet Franc;2019;Still;Red;Argentina;Mendoza;Uco Valley;Dry;Cork;13.50%;Full;;['100% Cabernet Franc']
360;Zuccardi, Q Malbec, Uco Valley, Mendoza, Argentina, 2019;Zuccardi;Q Malbec;2019;Still;Red;Argentina;Mendoza;Uco Valley;Dry;Cork;14.00%;Full;Lightly Oaked;['100% Malbec']
361;Zuccardi, Valles Malbec, Uco Valley, Mendoza, 2018;Zuccardi;Valles Malbec;2018;Still;Red;Argentina;Mendoza;Uco Valley;Dry;Cork;14.00%;Full;Lightly Oaked;['100% Malbec']
362;Luigi Bosca, Malbec, Mendoza, Argentina, 2018;Luigi Bosca;Malbec;2018;Still;Red;Argentina;Mendoza;;Dry;Cork;14.50%;Full;Oaked;['100% Malbec']
363;Zuccardi, José Zuccardi Malbec, Uco Valley, Mendoza, 2016;Zuccardi;José Zuccardi Malbec;2016;Still;Red;Argentina;Mendoza;Uco Valley;Dry;Cork;14.50%;Full;Oaked;['5% Cabernet Sauvignon', '95% Malbec']
364;Luigi Bosca, DOC Single Vineyard Malbec, Luján de Cuyo, 2018;Luigi Bosca;DOC Single Vineyard Malbec;2018;Still;Red;Argentina;Mendoza;Luján de Cuyo;Dry;Cork;14.50%;Full;Oaked;['100% Malbec']
365;Luigi Bosca, Malbec Selección de Vistalba, Luján de Cuyo;Luigi Bosca;Malbec Selección de Vistalba;2018;Still;Red;Argentina;Mendoza;Luján de Cuyo;Dry;Cork;14.00%;Full;Oaked;['100% Malbec']
366;Argento, Single Block Bloque 1 Malbec, Uco Valley, Paraje;Argento;Single Block Bloque 1 Malbec;2018;Still;Red;Argentina;Mendoza;Uco Valley;Dry;Cork;14.50%;Full;Lightly Oaked;['100% Malbec']
367;Bodegas Salentein, Barrel Selection Malbec, Uco Valley, 2019;Bodegas Salentein;Barrel Selection Malbec;2019;Still;Red;Argentina;Mendoza;Uco Valley;Dry;Cork;14.00%;Full;Oaked;['100% Malbec']
368;Trapiche, Terroir Series Finca Ambrosia, Uco Valley;Trapiche;Terroir Series Finca Ambrosia;2017;Still;Red;Argentina;Mendoza;Uco Valley;Dry;Cork;14.50%;Full;Oaked;['100% Malbec']
369;Rutini, Single Vineyard Gaultallary Malbec, Uco Valley, 2017;Rutini;Single Vineyard Gaultallary Malbec;2017;Still;Red;Argentina;Mendoza;Uco Valley;Dry;Cork;14.20%;Full;Oaked;['100% Malbec']
370;Finca La Luz, Callejón del Crimen Gran Reserva Malbec, Uco;Finca La Luz;Callejón del Crimen Gran Reserva Malbec;2017;Still;Red;Argentina;Mendoza;Uco Valley;Dry;Cork;14.10%;Full;Oaked;['100% Malbec']
371;Trivento, Reserve Malbec, Mendoza, Argentina, 2019;Trivento;Reserve Malbec;2019;Still;Red;Argentina;Mendoza;;Dry;Cork;13.50%;Full;Lightly Oaked;['100% Malbec']
372;Rutini, Apartado Gran Malbec, Uco Valley, Mendoza, 2017;Rutini;Apartado Gran Malbec;2017;Still;Red;Argentina;Mendoza;Uco Valley;Dry;Cork;14.80%;Full;Oaked;['100% Malbec']
373;Small but Perfectly Formed, Malbec, Mendoza;Small but Perfectly Formed;Malbec;;Still;Red;Argentina;Mendoza;;Dry;Can;13.50%;Medium;;['100% Malbec']
374;Nice, Malbec, Argentina;Nice;Malbec;;Still;Red;Argentina;;;Dry;Can;13.50%;Medium;Unoaked;['Malbec']
375;Las Dalias, Malbec, Mendoza, Argentina 2020;Las Dalias;Malbec;2020;Still;Red;Argentina;Mendoza;;Dry;Screwcap;14.00%;Full;Unoaked;['100% Malbec']
376;Amalaya, Blanco de Corte Torrontes-Riesling, Calchaquí Valley, Salta, Argentina 2019;Amalaya;Blanco de Corte Torrontes-Riesling;2019;Still;White;Argentina;Salta;Calchaquí Valley;Dry;Screwcap;13.00%;Light;;['15% Riesling', '85% Torrontés']
377;Clos de los Siete, Red Blend, Uco Valley, Mendoza, Argentina 2017;Clos de los Siete;Red Blend;2017;Still;Red;Argentina;Mendoza;Uco Valley;Dry;Cork;14.50%;Full;Oaked;['52% Malbec', '21% Merlot', '15% Syrah / Shiraz']
378;Finca La Anita, Cabernet Sauvignon, Luján de Cuyo, Agrelo;Finca La Anita;Cabernet Sauvignon;2018;Still;Red;Argentina;Mendoza;Luján de Cuyo;Dry;Cork;14.50%;Full;Oaked;['100% Cabernet Sauvignon']
379;Finca La Anita, Gran Corte NV, Luján de Cuyo, Agrelo;Finca La Anita;Gran Corte NV;;Still;Red;Argentina;Mendoza;Luján de Cuyo;Dry;Cork;14.50%;Full;Oaked;['41% Malbec', '59% Syrah / Shiraz']
380;Finca La Anita, Malbec, Luján de Cuyo, Agrelo, 2018;Finca La Anita;Malbec;2018;Still;Red;Argentina;Mendoza;Luján de Cuyo;Dry;Cork;14.50%;Full;Oaked;['100% Malbec']
381;Finca La Anita, Sauvignon Blanc, Luján de Cuyo, Agrelo, 2019;Finca La Anita;Sauvignon Blanc;2019;Still;White;Argentina;Mendoza;Luján de Cuyo;Dry;Cork;13.00%;Full;Unoaked;['100% Sauvignon Blanc']
382;Bodega Argento, Artesano de Argento Organic Malbec, Luján de;Bodega Argento;Artesano de Argento Organic Malbec;2019;Still;Red;Argentina;Mendoza;Luján de Cuyo;Dry;Cork;14.50%;Full;Lightly Oaked;['100% Malbec']
383;Catena, La Marchigiana Criolla Chica, Mendoza, Argentina 2019;Catena;La Marchigiana Criolla Chica;2019;Still;Red;Argentina;Mendoza;;Dry;Cork;13.50%;Light;;['100% Criolla Chica']
384;Otronia, III & VI, Patagonia, Argentina 2017;Otronia;III & VI;2017;Still;White;Argentina;Patagonia;;Dry;Cork;13.50%;Medium;;['100% Chardonnay']
385;Asda, Extra Special Malbec, San Juan, Argentina, 2019;Asda;Extra Special Malbec;2019;Still;Red;Argentina;San Juan;;Dry;;13.50%;Medium;;['Malbec']
386;Rutini, Single Vineyard Cabernet Franc, Uco Valley;Rutini;Single Vineyard Cabernet Franc;2017;Still;Red;Argentina;Mendoza;Uco Valley;Dry;Cork;13.50%;;;['100% Cabernet Franc']
387;Bodega Aleanna, Gran Enemigo Single Vineyard Chacayes, 2016;Bodega Aleanna;Gran Enemigo Single Vineyard Chacayes;2016;Still;Red;Argentina;Los Chacayes, Tunuyán;;Dry;Cork;13.50%;;;['85% Cabernet Franc', '15% Malbec']
388;El Porvenir de Cafayate, Laborum De Parcela Torrontés;El Porvenir de Cafayate;Laborum De Parcela Torrontés;2018;Still;White;Argentina;Salta;Cafayate Valley;Dry;Screwcap;12.50%;;;['100% Torrontés']
389;Trivento, Gaudeo Single Vineyard Malbec, Uco Valley;Trivento;Gaudeo Single Vineyard Malbec;2018;Still;Red;Argentina;Mendoza;Uco Valley;Dry;Cork;14.00%;;;['Malbec']
390;Bodega Alandes, Paradoux Blanc de Blancs, Uco Valley, La;Bodega Alandes;Paradoux Blanc de Blancs;;Still;White;Argentina;Mendoza;Uco Valley;Dry;Cork;14.00%;;;['Sauvignon Blanc', 'Sémillon']
391;Rutini, Single Vineyard Altamira Malbec, Uco Valley, Paraje;Rutini;Single Vineyard Altamira Malbec;2019;Still;Red;Argentina;Mendoza;Uco Valley;Dry;Cork;13.50%;Full;Oaked;['100% Malbec']
392;Rutini, Trumpeter Sauvignon Blanc, Mendoza, Argentina, 2019;Rutini;Trumpeter Sauvignon Blanc;2019;Still;White;Argentina;Mendoza;;Dry;Cork;13.30%;Medium;Lightly Oaked;['100% Sauvignon Blanc']
393;Bodega Norton, Perdriel Series Malbec, 2018;Bodega Norton;Perdriel Series Malbec;2018;Still;Red;Argentina;Las Compuertas, Luján de Cuyo;;Dry;Cork;14.50%;Full;Oaked;['100% Malbec']
394;Bodega Norton, Altura Cabernet Franc, 2017;Bodega Norton;Altura Cabernet Franc;2017;Still;Red;Argentina;Altamira, San Carlos;;Dry;Cork;14.50%;Full;Oaked;['100% Cabernet Franc']
395;Bodega Norton, Altura Malbec, Los Chacayes, Tunuyán, 2017;Bodega Norton;Altura Malbec;2017;Still;Red;Argentina;;;;;;;;
396;Bodega Norton, Altura Pinot Noir, 2018;Bodega Norton;Altura Pinot Noir;2018;Still;Red;Argentina;Gualtallary, Tupungato;;Dry;Cork;14.00%;Full;Unoaked;['100% Pinot Noir / Pinot Nero']
397;Luigi Bosca, Selección de Vistalba Malbec, Mendoza, Argentina 2018;Luigi Bosca;Selección de Vistalba Malbec;2018;Still;Red;Argentina;Mendoza;;Dry;Cork;14.10%;;Oaked;['100% Malbec']
398;Norton, Perdriel Extra Brut NV, Argentina;Norton;Perdriel Extra Brut NV;;Sparkling;White;Argentina;;;Brut;Cork;12.50%;Light;;['Chardonnay', 'Pinot Noir / Pinot Nero']
399;Montes, Kaiken Brut Traditional, Uco Valley, Gualtallary;Montes;Kaiken Brut Traditional;;Sparkling;White;Argentina;Mendoza;Uco Valley;Brut;Natural Cork;12.50%;Light;;['30% Chardonnay', '70% Pinot Noir / Pinot Nero']
400;Bodega Atamisque, Vicomte De Rochebouët Extra Brut, Uco;Bodega Atamisque;Vicomte De Rochebouët Extra Brut;;Sparkling;White;Argentina;Mendoza;Uco Valley;Extra Brut;Natural Cork;13.00%;Light;;['70% Chardonnay', '30% Pinot Noir / Pinot Nero']
401;Bodegas Fabre, Viñalba Reserve Cabernet Sauvignon, Mendoza, Argentina 2019;Bodegas Fabre;Viñalba Reserve Cabernet Sauvignon;2019;Still;Red;Argentina;Mendoza;;Dry;;14.50%;;;['85% Cabernet Sauvignon', '15% Malbec']
402;Alandes, Paradoux Semillon-Sauvignon Blanc NV, Uco Valley;Alandes;Paradoux Semillon-Sauvignon Blanc NV;;Still;White;Argentina;Uco Valley;;Dry;Cork;13.40%;Medium;Oaked;['33% Sauvignon Blanc', '67% Sémillon']
403;Zuccardi, Fósil, San Pablo, Tunuyán, Mendoza, 2019;Zuccardi;Fósil;2019;Still;White;Argentina;San Pablo, Tunuyán;;Dry;Cork;13.50%;Medium;Lightly Oaked;['100% Chardonnay']
404;Bodegas Salentein, Single Vineyard Los Nogales Sauvignon;Bodegas Salentein;Single Vineyard Los Nogales Sauvignon Blanc;2018;Still;White;Argentina;San Pablo, Tunuyán;;Dry;Cork;13.00%;Medium;Unoaked;['100% Sauvignon Blanc']
405;Zorzal, El Barba Malbec, Gualtallary, Tupungato, 2017;Zorzal;El Barba Malbec;2017;Still;Red;Argentina;Gualtallary, Tupungato;;Dry;Cork;14.50%;Full;Oaked;['100% Malbec']
