;Title;Producer;Brand;Vintage;Wine Type;Colour;Country;Region;Appellation;Sweetness;Closure;Alcohol;Body;Oak;Grapes
536;Viña Cobos, Bramare Malbec, Luján de Cuyo, Mendoza, 1999;Viña Cobos;Bramare Malbec;1999;Still;Red;Argentina;Mendoza;Luján de Cuyo;Dry;Natural Cork;14.70%;Full;Oaked;['100% Malbec']
537;Viña Cobos, Chañares Vineyard Malbec, Uco Valley, 2015;Viña Cobos;Chañares Vineyard Malbec;2015;Still;Red;Argentina;Mendoza;Uco Valley;Dry;Natural Cork;15.00%;Full;Oaked;['100% Malbec']
538;Viña Cobos, Bramare Marchiori Estate Malbec, Luján de Cuyo 2011;Viña Cobos;Bramare Marchiori Estate Malbec;2011;Still;Red;Argentina;Mendoza;Luján de Cuyo;Dry;Natural Cork;15.60%;Full;Oaked;['100% Malbec']
539;Viña Cobos, Bramare Zingaretti Estate Malbec, Uco Valley 2016;Viña Cobos;Bramare Zingaretti Estate Malbec;2016;Still;Red;Argentina;Mendoza;Uco Valley;Dry;Natural Cork;14.00%;Full;Oaked;['100% Malbec']
540;Viña Cobos, Bramare Zingaretti Estate Chardonnay, Uco Valley 2018;Viña Cobos;Bramare Zingaretti Estate Chardonnay;2018;Still;White;Argentina;Mendoza;Uco Valley;Dry;Natural Cork;14.30%;Full;Oaked;['100% Chardonnay']
541;Viñalba, Cuvée Couture, Malbec Touriga Nacional Reservado, Mendoza 2013;Viñalba;Cuvée Couture;2013;;Red;Argentina;Mendoza;;;;14.50%;;;['Malbec', 'Touriga Nacional']
542;Passionate Wine, Demente, Uco Valley, Gualtallary, 2013;Passionate Wine;Demente;2013;Still;Red;Argentina;Mendoza;Uco Valley;;;14.50%;;;['Cabernet Franc', 'Malbec']
543;Gen del Alma, Ji Ji Ji, Uco Valley, Gualtallary, 2014;Gen del Alma;Ji Ji Ji;2014;Still;Red;Argentina;Mendoza;Uco Valley;;;12.10%;;;['Malbec', 'Pinot Noir / Pinot Nero']
544;Bodegas La Rosa, Hereford Tempranillo-Malbec, Mendoza, 2018;Bodegas La Rosa;Hereford Tempranillo-Malbec;2018;Still;Red;Argentina;Mendoza;;Dry;;12.50%;;;['Malbec']
545;55 Malbec, Teho Tomal Vineyard Red Blend, Uco Valley, La;55 Malbec;Teho Tomal Vineyard Red Blend;2011;;Red;Argentina;Uco Valley;Uco Valley;;;14.00%;;;['Cabernet Sauvignon', 'Malbec']
546;Viñedos Casta del Sur, Canyengue, Agrelo, Mendoza, Luján de Cuyo 2012;Viñedos Casta del Sur;Canyengue;2012;Still;Red;Argentina;Mendoza;Luján de Cuyo;;;15.00%;;;['Malbec']
547;Finca Sophenia, Roberto L, Uco Valley, Gualtallary, 2011;Finca Sophenia;Roberto L;2011;;Red;Argentina;Uco Valley;Uco Valley;;;15.00%;;;['Malbec']
548;Chakana, Estate Selection, Red Blend, Uco Valley, 2013;Chakana;Red Blend;2013;;Red;Argentina;Uco Valley;;;;14.50%;;;['Cabernet Sauvignon', 'Malbec', 'Syrah / Shiraz']
549;Luigi Bosca, Malbec Petit-Verdot Field Blend, Finca Los Nobles, Las Compuertas, Mendoza, Luján de Cuyo 2011;Luigi Bosca;Finca Los Nobles Malbec Petit-Verdot Field Blend;2011;Still;Red;Argentina;Mendoza;Las Compuertas;;;14.50%;;;['Malbec', 'Petit Verdot']
550;Melipal, Agrelo, Luján de Cuyo, Mendoza, Argentina, 2012;Melipal;Agrelo;2012;Still;Red;Argentina;Mendoza;Luján de Cuyo;;;14.90%;;;['Malbec']
551;Tupun, Vulcano, Gran Reserva, Uco Valley, Tupungato, 2013;Tupun;Gran Reserva;2013;;Red;Argentina;Uco Valley;Uco Valley;;;14.30%;;;['Malbec']
552;Cheval des Andes, Mendoza, Argentina, 2014;Cheval des Andes;;2014;Still;Red;Argentina;Mendoza;;;Natural Cork;;;;
553;Cheval des Andes, Mendoza, Argentina, 2009;Cheval des Andes;;2009;Still;Red;Argentina;Mendoza;;;Natural Cork;;Medium;Oaked;['36% Cabernet Sauvignon', '59% Malbec', '5% Petit Verdot']
554;Susana Balbo, Crios Cabernet Sauvignon, Mendoza, 2017;Susana Balbo;Crios Cabernet Sauvignon;2017;Still;Red;Argentina;Mendoza;;Dry;Screwcap;14.00%;Full;;['Cabernet Sauvignon']
555;Estancia Uspallata, Malbec, Uspallata, Luján de Cuyo, 2017;Estancia Uspallata;Malbec, Uspallata;2017;Still;Red;Argentina;Mendoza;Luján de Cuyo;Dry;Cork;14.00%;Full;;['Malbec']
556;Susana Balbo, Signature White Blend, Uco Valley, 2017;Susana Balbo;Signature White Blend;2017;Still;White;Argentina;Mendoza;Uco Valley;Dry;Cork;13.00%;Light;Oaked;['25% Sauvignon Blanc', '45% Sémillon', '30% Torrontés']
557;PerSe, La Craie, Uco Valley, Gualtallary, Mendoza, 2015;PerSe;La Craie;2015;Still;Red;Argentina;Mendoza;Uco Valley;Dry;Cork;14.80%;Full;;['20% Cabernet Franc', '80% Malbec']
558;Contra Corriente, Pinot Noir, Chubut, Patagonia, 2018;Contra Corriente;Pinot Noir;2018;Still;Red;Argentina;Patagonia;Chubut;Dry;;12.40%;;;['100% Pinot Noir / Pinot Nero']
559;Otronia, Block 3 & 6 Chardonnay, Chubut, Patagonia, 2017;Otronia;Block 3 & 6 Chardonnay;2017;Still;White;Argentina;Patagonia;Chubut;Dry;;13.80%;;;['100% Chardonnay']
560;Doña Paula, Alluvia Parcel Malbec, Uco Valley, Tupungato 2014;Doña Paula;Alluvia Parcel Malbec;2014;Still;Red;Argentina;Mendoza;Uco Valley;Dry;Cork;14.00%;Full;;['100% Malbec']
561;TintoNegro, 1955 Vineyard Malbec, Uco Valley, La Consulta 2017;TintoNegro;1955 Vineyard Malbec;2017;Still;Red;Argentina;Mendoza;Uco Valley;Dry;Cork;14.00%;Full;;['100% Malbec']
562;Vinos de La Luz, Iluminado Single Vineyard Malbec, Uco Valley 2015;Vinos de La Luz;Iluminado Single Vineyard Malbec;2015;Still;Red;Argentina;Mendoza;Uco Valley;Dry;Cork;14.00%;Full;;['100% Malbec']
563;Bodega Vistalba, Tomero Gran Reserva Malbec, Uco Valley 2016;Bodega Vistalba;Tomero Gran Reserva Malbec;2016;Still;Red;;;;;;;;;
564;O Fournier, Alfa Crux Malbec, Uco Valley, Mendoza, 2012;O Fournier;Alfa Crux Malbec;2012;Still;Red;Argentina;Mendoza;Uco Valley;Dry;Cork;15.00%;Full;;['100% Malbec']
565;Vicentin, Maldito, Mendoza, Argentina;Vicentin;Maldito;;Still;Red;Argentina;Mendoza;;Dry;Cork;15.00%;Full;;['100% Malbec']
566;Altos Las Hormigas, Malbec, Uco Valley, Gualtallary, 2016;Altos Las Hormigas;Malbec;2016;Still;Red;Argentina;Mendoza;Uco Valley;Dry;Cork;14.50%;Full;;['100% Malbec']
567;Bodega Colomé, 1831 Malbec, Calchaquí Valley, Salta, 2016;Bodega Colomé;1831 Malbec;2016;Still;Red;Argentina;Salta;Calchaquí Valley;Dry;Cork;15.00%;Full;;['100% Malbec']
568;Doña Paula, Selección de Bodega Malbec, Mendoza, 2015;Doña Paula;Selección de Bodega Malbec;2015;Still;Red;Argentina;Mendoza;;Dry;Cork;14.00%;Full;;['100% Malbec']
569;Kaiken, Mai, Luján de Cuyo, Mendoza, Argentina, 2014;Kaiken;Mai;2014;Still;Red;Argentina;Mendoza;Luján de Cuyo;Dry;Cork;14.50%;Full;;['100% Malbec']
570;Rutini, Apartado Gran Malbec, Uco Valley, Mendoza, 2015;Rutini;Apartado Gran Malbec;2015;Still;Red;Argentina;Mendoza;Uco Valley;Dry;Cork;14.00%;Full;;['100% Malbec']
571;Finca Flichman, Dedicado Gran Malbec, Uco Valley, 2014;Finca Flichman;Dedicado Gran Malbec;2014;Still;Red;Argentina;Mendoza;Uco Valley;Dry;Cork;13.50%;Full;;['100% Malbec']
572;Trivento, Eolo, Luján de Cuyo, Mendoza, Argentina, 2015;Trivento;Eolo;2015;Still;Red;Argentina;Mendoza;Luján de Cuyo;Dry;Cork;14.00%;Full;;['100% Malbec']
573;Cadus, Single Vineyard Finca Viña Vida Malbec, Uco Valley;Cadus;Single Vineyard Finca Viña Vida Malbec;2014;Still;Red;Argentina;Mendoza;Uco Valley;Dry;Cork;14.00%;Full;;['100% Malbec']
574;Carelli, Malbec, Mendoza, Argentina, 2009;Carelli;Malbec;2009;Still;Red;Argentina;Mendoza;;Dry;Cork;14.50%;Full;;['100% Malbec']
575;Zuccardi, Aluvional Tupungato Alto Malbec, Uco Valley 2014;Zuccardi;Aluvional Tupungato Alto Malbec;2014;Still;Red;Argentina;Mendoza;Uco Valley;Dry;Cork;14.00%;Full;;['100% Malbec']
576;Bodega Teho, Tomal Vineyard Malbec, Uco Valley, La Consulta 2017;Bodega Teho;Tomal Vineyard Malbec;2017;Still;Red;Argentina;Mendoza;Uco Valley;Dry;Cork;14.00%;Full;;['100% Malbec']
577;Rutini, Single Vineyard Malbec, Uco Valley, Gualtallary 2016;Rutini;Single Vineyard Malbec;2016;Still;Red;Argentina;Mendoza;Uco Valley;Dry;Cork;14.00%;Full;;['100% Malbec']
578;Trapiche, Terroir Series Finca Coletto Malbec, Uco Valley 2014;Trapiche;Terroir Series Finca Coletto Malbec;2014;Still;Red;Argentina;Mendoza;Uco Valley;Dry;Cork;14.50%;Full;;['100% Malbec']
579;Susana Balbo, Dominio del Plata Nosotros, Uco Valley 2011;Susana Balbo;Dominio del Plata Nosotros;2011;Still;Red;Argentina;Mendoza;Uco Valley;Dry;Cork;15.00%;Full;;['100% Malbec']
580;Bodega Colomé, Auténtico Malbec, Calchaquí Valley, 2018;Bodega Colomé;Auténtico Malbec;2018;Still;Red;Argentina;Salta;Calchaquí Valley;Dry;Cork;14.50%;Full;;['100% Malbec']
581;Bodega Piedra Negra, Gran Malbec, Uco Valley, Mendoza, 2013;Bodega Piedra Negra;Gran Malbec;2013;Still;Red;Argentina;Mendoza;Uco Valley;;;15.00%;;;['50% Malbec 2', '50% Malbec']
582;Bodega Piedra Negra, Chacayes, Uco Valley, Tunuyán, 2014;Bodega Piedra Negra;Chacayes;2014;Still;Red;Argentina;Mendoza;Uco Valley;Dry;Cork;15.00%;Full;;['100% Malbec']
583;Escorihuela Gascón, The President’s Blend, Uco Valley, 2017;Escorihuela Gascón;The President’s Blend;2017;Still;Red;Argentina;Mendoza;Uco Valley;Dry;Cork;14.00%;Full;;['100% Malbec']
584;Bodega Colomé, Altura Maxima Malbec, Calchaquí Valley, 2015;Bodega Colomé;Altura Maxima Malbec;2015;Still;Red;Argentina;Salta;Calchaquí Valley;Dry;Cork;14.50%;Full;;['100% Malbec']
585;Bodega Colomé, Estate Torrontes, Calchaquí Valley, 2018;Bodega Colomé;Estate Torrontes;2018;Still;White;Argentina;Salta;Calchaquí Valley;Dry;Screwcap;13.50%;Light;Unoaked;['100% Torrontés']
586;El Porvenir de Cafayate, Amauta Absoluto Torrontes, Cafayate 2019;El Porvenir de Cafayate;Amauta Absoluto Torrontes;2019;Still;White;Argentina;Salta;Cafayate Valley;Dry;Cork;13.00%;Light;Unoaked;['100% Torrontés']
587;Alma Gemela, White Field Blend, Uco Valley, Mendoza, 2017;Alma Gemela;White Field Blend;2017;Still;White;Argentina;Mendoza;Uco Valley;Dry;Cork;13.50%;Light;Oaked;['33% Chardonnay', '33% Marsanne', '33% Roussanne']
588;Andeluna, 1300 Torrontes, Uco Valley, Mendoza, 2018;Andeluna;1300 Torrontes;2018;Still;White;Argentina;Mendoza;Uco Valley;Dry;Screwcap;12.50%;Light;Unoaked;['100% Torrontés']
589;Finca Las Glicinas, Jengibre Semillon, Uco Valley, 2019;Finca Las Glicinas;Jengibre Semillon;2019;Still;White;Argentina;Mendoza;Uco Valley;Dry;Screwcap;14.00%;Light;Oaked;['100% Sémillon']
590;El Porvenir de Cafayate, Laborum Oak-Fermented Torrontes 2018;El Porvenir de Cafayate;Laborum Oak-Fermented Torrontes;2018;Still;White;Argentina;Salta;Cafayate Valley;Dry;Cork;13.50%;Light;Oaked;['100% Torrontés']
591;Kaiken, Terroir Series Torrontes, Cafayate Valley, 2018;Kaiken;Terroir Series Torrontes;2018;Still;White;Argentina;Salta;Cafayate Valley;Dry;Screwcap;13.50%;Light;Unoaked;['100% Torrontés']
592;Riccitelli, Sémillon, Río Negro, Patagonia, Argentina, 2017;Riccitelli;Sémillon;2017;Still;White;Argentina;Patagonia;Río Negro;Dry;Cork;12.50%;Light;Oaked;['100% Sémillon']
593;El Esteco, 1945 Old Vine Torrontes, Calchaquí Valley, 2018;El Esteco;1945 Old Vine Torrontes;2018;Still;White;Argentina;Salta;Calchaquí Valley;Dry;Cork;13.00%;Light;;['100% Torrontés']
594;Amalaya, Torrontes-Riesling, Calchaquí Valley, Salta, 2018;Amalaya;Torrontes-Riesling;2018;Still;White;Argentina;Salta;Calchaquí Valley;Dry;Screwcap;12.50%;Light;;['15% Riesling', '85% Torrontés']
595;Casarena, Winemaker's Selection Torrontés, Salta, 2018;Casarena;Winemaker's Selection Torrontés;2018;Still;White;Argentina;Salta;;Dry;Screwcap;13.50%;Light;Unoaked;['100% Torrontés']
596;Humberto Canale, Old Vineyard Semillon, Río Negro, 2017;Humberto Canale;Old Vineyard Semillon;2017;Still;White;Argentina;Patagonia;Río Negro;Dry;Cork;13.00%;Light;Oaked;['100% Sémillon']
597;El Esteco, Blanc de Blancs, Calchaquí Valley, Salta, 2018;El Esteco;Blanc de Blancs;2018;Still;White;Argentina;Salta;Calchaquí Valley;Dry;Cork;13.00%;Light;;['40% Chardonnay', '15% Marsanne', '15% Roussanne']
598;Alandes, Paradoux Blend Sémillon-Sauvignon Blanc, Mendoza;Alandes;Paradoux Blend Sémillon-Sauvignon Blanc;;Still;White;Argentina;Mendoza;;Dry;Cork;12.50%;Light;;['Sauvignon Blanc', '50% Sémillon']
599;Gauchezco, Torrontes, Salta, Argentina, 2017;Gauchezco;Torrontes;2017;Still;White;Argentina;Salta;;Dry;Cork;13.50%;Light;;['Torrontés']
600;De Angeles, Viña 1924 Gran Malbec, Luján de Cuyo, Vistalba 2013;De Angeles;Viña 1924 Gran Malbec;2013;Still;Red;Argentina;Mendoza;Luján de Cuyo;Dry;Cork;14.50%;Medium;;['Malbec']
601;Bodega Teho, Tomal Vineyard Malbec, Uco Valley 2014;Bodega Teho;Tomal Vineyard Malbec;2014;Still;Red;Argentina;Mendoza;Uco Valley;Dry;Cork;13.50%;Medium;;['Malbec']
602;Cara Sur, Criolla Chica, Calingasta Valley, San Juan, 2015;Cara Sur;Criolla Chica;2015;Still;Red;Argentina;San Juan;Calingasta Valley;Dry;Cork;14.50%;Medium;;['País']
603;Riccitelli, Old Vine Semillon, Río Negro, Patagonia, 2017;Riccitelli;Old Vine Semillon;2017;Still;White;Argentina;Patagonia;Río Negro;Dry;Cork;13.00%;Medium;;['Sémillon']
604;Bodega Colomé, Auténtico Malbec, Calchaquí Valley, 2017;Bodega Colomé;Auténtico Malbec;2017;Still;Red;Argentina;Salta;Calchaquí Valley;Dry;Cork;14.50%;Medium;;['Malbec']
605;Chacra, 32 Pinot Noir, Patagonia, Argentina, 2016;Chacra;32 Pinot Noir;2016;Still;Red;Argentina;Patagonia;;Dry;Cork;12.00%;Medium;;['Pinot Noir / Pinot Nero']
606;Bodegas Fabre, Viñalta Malbec, Mendoza, Argentina, 2017;Bodegas Fabre;Viñalta Malbec;2017;Still;Red;Argentina;Mendoza;;Dry;;13.50%;Medium;;['Malbec']
607;Altos Las Hormigas, Malbec, Mendoza, Argentina, 2018;Altos Las Hormigas;Malbec;2018;Still;Red;Argentina;Mendoza;;Dry;;13.50%;;;['100% Malbec']
608;Bodega Aleanna, El Enemigo Malbec, Uco Valley, Gualtallary;Bodega Aleanna;El Enemigo Malbec;2013;Still;Red;Argentina;Mendoza;Uco Valley;Dry;;13.50%;Full;Oaked;['3% Cabernet Franc', '90% Malbec', '7% Petit Verdot']
609;Familia Schroeder, Saurus Select Malbec, Neuquén, 2014;Familia Schroeder;Saurus Select Malbec;2014;Still;Red;Argentina;Neuquén;;;;14.50%;;;['Malbec']
610;Dominio del Plata, Ben Marco Torrontés, Mendoza, 2012;Dominio del Plata;Ben Marco Torrontés;2012;Still;White;Argentina;Mendoza;;;;14.00%;;;
611;Riccitelli, Old Vines Semillón, Río Negro, Patagonia, 2015;Riccitelli;Old Vines Semillón;2015;Still;White;Argentina;Patagonia;Río Negro;Dry;;14.00%;;Lightly Oaked;['100% Sémillon']
612;Bodegas Salentein, Finca San Pablo Single Vineyard;Bodegas Salentein;Finca San Pablo Single Vineyard Chardonnay;2015;Still;White;Argentina;Mendoza;Uco Valley;Dry;Cork;13.50%;Full;;['Chardonnay']
613;Bodegas Salentein, Barrel Selection Malbec, Uco Valley, 2013;Bodegas Salentein;Barrel Selection Malbec;2013;;Red;Argentina;Mendoza;Uco Valley;;;14.00%;;;['Malbec']
614;Zuccardi, Pologonos San Pablo Vineyard Malbec, Gualtallary 2016;Zuccardi;Pologonos San Pablo Vineyard Malbec;2016;Still;Red;Argentina;Mendoza;Uco Valley;Dry;Cork;14.00%;Full;;['100% Malbec']
615;Zuccardi, Piedra Infinita Gravascal, Uco Valley, Altamira;Zuccardi;Piedra Infinita Gravascal;2015;Still;Red;Argentina;Mendoza;Uco Valley;Dry;Cork;13.50%;Full;;['Malbec']
616;Viña Cobos, Felino, Mendoza, Argentina, 2017;Viña Cobos;Felino;2017;Still;Red;Argentina;Mendoza;;Dry;Cork;14.00%;Full;;['Malbec']
617;Pablo Y Walter, Malbec, Mendoza, Argentina, 2017;Pablo Y Walter;Malbec;2017;Still;Red;Argentina;Mendoza;;Dry;Screwcap;13.50%;Full;;['Malbec']
618;Bodega Benegas, Benegas Lynch Malbec 2015;Bodega Benegas;Benegas Lynch Malbec;2015;Still;Red;Argentina;Mendoza;Uco Valley;Dry;Cork;14.50%;Medium;Oaked;['100% Malbec']
619;Michelini I Mufatto, La Cautiva, Uco Valley 2016;Michelini i Mufatto;La Cautiva;2016;Still;Red;Argentina;Mendoza;Uco Valley;Dry;Cork;13.00%;Medium;Oaked;['100% Malbec']
620;Finca Sophenia, Reserve Malbec, Uco Valley, Gualtallary 2016;Finca Sophenia;Reserve Malbec;2016;Still;Red;Argentina;Mendoza;Uco Valley;Dry;;13.50%;Full;Oaked;['100% Malbec']
621;Bodega Vistalba, Tomero Parcela Unica Malbec 2017;Bodega Vistalba;Tomero Parcela Unica Malbec;2017;Still;Red;Argentina;Mendoza;Uco Valley;Dry;Cork;14.50%;Medium;Oaked;['100% Malbec']
622;Susana Balbo, Benmarco Expresivo, Uco Valley, Mendoza, 2016;Susana Balbo;Benmarco Expresivo;2016;Still;Red;Argentina;Mendoza;Uco Valley;Dry;Cork;14.00%;Full;;['25% Cabernet Franc', '75% Malbec']
623;Aniello, Viña 1932 Trousseau, Río Negro, Patagonia, 2015;Aniello;Viña 1932 Trousseau;2015;Still;Red;Argentina;Patagonia;Río Negro;Dry;Cork;13.50%;Full;;['Trousseau']
624;Bodegas Noemía, Noemía, Río Negro, Patagonia, 2014;Bodegas Noemía;Noemía;2014;Still;Red;Argentina;Patagonia;;;;;;;
625;Bodega Chacra, Cincuenta y Cinco, Río Negro, 2015;Bodega Chacra;Cincuenta y Cinco;2015;Still;Red;Argentina;Patagonia;Río Negro;Dry;Cork;12.80%;Medium;;['Pinot Noir / Pinot Nero']
626;Malma, Finca La Papay Malbec, Neuquén, Patagonia, 2016;Malma;Finca La Papay Malbec;2016;Still;Red;Argentina;Patagonia;Neuquén;Dry;Cork;14.00%;Medium;;['Malbec']
627;Bodega Chacra, Barda, Río Negro, Patagonia, Argentina, 2014;Bodega Chacra;Barda;2014;Still;Red;Argentina;Patagonia;Río Negro;Dry;Cork;13.00%;Medium;;['Pinot Noir / Pinot Nero']
628;Bodegas del Fin del Mundo, La Poderosa, Neuquén, 2016;Bodegas del Fin del Mundo;La Poderosa;2016;Still;Red;Argentina;Patagonia;Neuquén;Dry;Cork;14.50%;Medium;;['Malbec']
629;Bodegas del Fin del Mundo, Special Blend, Neuquén, 2012;Bodegas del Fin del Mundo;Special Blend;2012;Still;Red;Argentina;Patagonia;Neuquén;Dry;Cork;14.70%;Full;;['Cabernet Sauvignon', 'Malbec', 'Merlot']
630;Bodegas Noemía, J Alberto, Río Negro, Patagonia, 2015;Bodegas Noemía;J Alberto;2015;Still;Red;Argentina;Patagonia;Río Negro;Dry;Cork;13.50%;Medium;;['Malbec']
631;Bodega Chacra, Treinta y Dos, Río Negro, Patagonia, 2014;Bodega Chacra;Treinta y Dos;2014;Still;Red;Argentina;Patagonia;Río Negro;Dry;Cork;13.00%;Medium;;['Pinot Noir / Pinot Nero']
632;Bodegas Noemía, A Lisa, Río Negro, Patagonia, 2015;Bodegas Noemía;A Lisa;2015;Still;Red;Argentina;Patagonia;Río Negro;Dry;Cork;13.50%;Medium;;['Malbec']
633;Riccitelli, The Party Malbec, Uco Valley, Mendoza, 2017;Riccitelli;The Party Malbec;2017;Still;Red;Argentina;Mendoza;Uco Valley;Dry;Cork;14.00%;Full;;['Malbec']
634;Andeluna, Pasionado Malbec, Uco Valley, Gualtallary, 2014;Andeluna;Pasionado Malbec;2014;Still;Red;Argentina;Mendoza;Uco Valley;Dry;;14.50%;Full;Oaked;['100% Malbec']
635;Andeluna, Altitud Malbec, Uco Valley, Gualtallary, 2014;Andeluna;Altitud Malbec;2014;Still;Red;Argentina;Mendoza;Uco Valley;Dry;;14.50%;Full;Oaked;['100% Malbec']
636;Escorihuela Gascón, Pequeñas Producciones Cabernet Sauvignon, Altamira 2015;Escorihuela Gascón;Pequeñas Producciones Cabernet Sauvignon;2015;Still;Red;Argentina;Mendoza;Uco Valley;Dry;;14.00%;Full;Oaked;['100% Cabernet Sauvignon']
637;Vinos De Potrero, Malbec, Uco Valley, Gualtallary, 2016;Vinos De Potrero;Malbec;2016;Still;Red;Argentina;Mendoza;Uco Valley;Dry;;14.00%;Full;Oaked;['100% Malbec']
638;Zorzal, Eggo Tinto de Tiza, Uco Valley, Gualtallary, 2014;Zorzal;Eggo Tinto de Tiza;2014;Still;Red;Argentina;Mendoza;;;;;;;
639;Bodega Teho, Zaha Toko Vineyard Cabernet Franc, Uco Valley, Altamira 2015;Bodega Teho;Zaha Toko Vineyard Cabernet Franc;2015;Still;Red;Argentina;Mendoza;Uco Valley;Dry;;13.50%;Full;Oaked;['100% Cabernet Franc']
640;Passionate Wine, Punta Negra Pinot Noir, Uco Valley, Gualtallary 2015;Passionate Wine;Punta Negra Pinot Noir;2015;Still;Red;Argentina;Mendoza;Uco Valley;Dry;;13.00%;Medium;Oaked;['100% Pinot Noir / Pinot Nero']
641;Riglos, Gran Cabernet Franc, Uco Valley, Gualtallary, 2015;Riglos;Gran Cabernet Franc;2015;Still;Red;Argentina;Mendoza;Uco Valley;Dry;;15.00%;Full;Oaked;['100% Cabernet Franc']
642;Finca Sophenia, Anti Synthesis, Uco Valley, Gualtallary 2015;Finca Sophenia;Anti Synthesis;2015;Still;Red;Argentina;Mendoza;Uco Valley;Dry;;14.00%;Full;;['Cabernet Sauvignon', 'Malbec']
643;Viña Las Perdices, Exploración Malbec, Uco Valley, Altamira 2016;Viña Las Perdices;Exploración Malbec;2016;Still;Red;Argentina;Mendoza;Uco Valley;Dry;;14.50%;Full;Oaked;['100% Malbec']
644;Gimenez Riili, Gran Familia Malbec, Uco Valley, Altamira 2014;Gimenez Riili;Gran Familia Malbec;2014;Still;Red;Argentina;Mendoza;Uco Valley;Dry;;13.50%;Full;Oaked;['100% Malbec']
645;Vinos De Potrero, Reserva de Potrero Malbec, Uco Valley, Gualtallary 2016;Vinos De Potrero;Reserva de Potrero Malbec;2016;Still;Red;Argentina;Mendoza;Uco Valley;Dry;;14.00%;Full;Oaked;['10% Cabernet Franc', '90% Malbec']
646;Superuco, Calcáreo Coluvio de Altamira Malbec, Uco Valley, Altamira 2015;Superuco;Calcáreo Coluvio de Altamira Malbec;2015;Still;Red;Argentina;Mendoza;Uco Valley;Dry;;13.50%;Full;Oaked;['100% Malbec']
647;Trivento, Golden Reserve Black Series Malbec, Uco Valley, Gualtallary 2015;Trivento;Golden Reserve Black Series Malbec;2015;Still;Red;Argentina;Mendoza;Uco Valley;Dry;;15.00%;Full;Oaked;['100% Malbec']
648;Catena, Adrianna Vineyard River Stones Malbec, Uco Valley, Gualtallary 2014;Catena Zapata;Adrianna Vineyard River Stones Malbec;2014;Still;Red;Argentina;Mendoza;Uco Valley;Dry;;13.50%;Full;;['100% Malbec']
649;Solocontigo, Affaire, Uco Valley, Altamira, Mendoza, 2015;Solocontigo;Affaire;2015;Still;Red;Argentina;Mendoza;Uco Valley;Dry;;14.50%;Full;Oaked;['100% Malbec']
650;Superuco, Calcáreo Granito de Gualta Malbec, Uco Valley, Gualtallary 2015;Superuco;Calcáreo Granito de Gualta Malbec;2015;Still;Red;Argentina;Mendoza;Uco Valley;Dry;;14.00%;Full;Oaked;['100% Malbec']
651;Susana Balbo, Benmarco Expresivo Malbec, Uco Valley, Gualtallary 2015;Susana Balbo;Benmarco Expresivo Malbec;2015;Still;Red;Argentina;Mendoza;Uco Valley;Dry;;14.00%;Full;Oaked;['13% Cabernet Franc', '87% Malbec']
652;Escorihuela Gascón, Organic Vineyard Malbec, Uco Valley. Altamira 2016;Escorihuela Gascón;Organic Vineyard Malbec;2016;Still;Red;Argentina;Mendoza;Uco Valley;Dry;;13.00%;Full;Unoaked;['100% Malbec']
653;Rutini, Single Vineyard Cabernet Franc, Uco Valley 2014;Rutini;Single Vineyard Cabernet Franc;2014;Still;Red;Argentina;Mendoza;Uco Valley;Dry;;14.00%;Full;Oaked;['100% Cabernet Franc']
654;Los Clop, Reserva Cabernet Sauvignon, Altamira 2015;Los Clop;Reserva Cabernet Sauvignon;2015;Still;Red;Argentina;Mendoza;Uco Valley;Dry;;14.00%;Full;Oaked;['100% Cabernet Sauvignon']
655;Gen del Alma, Crua Chan Gualta Malbec, Gualtallary 2016;Gen del Alma;Crua Chan Gualta Malbec;2016;Still;Red;Argentina;Mendoza;Uco Valley;Dry;;14.00%;Full;Oaked;['100% Malbec']
656;Zorzal, Eggo Franco Cabernet Franc, Uco Valley, Tupungato 2016;Zorzal;Eggo Franco Cabernet Franc;2016;Still;Red;Argentina;Mendoza;Uco Valley;Dry;Natural Cork;13.50%;Full;Unoaked;['100% Cabernet Franc']
657;Finca Sophenia, Synthesis Sauvignon Blanc, Uco Valley;Finca Sophenia;Synthesis Sauvignon Blanc;2017;Still;White;Argentina;Mendoza;Uco Valley;Dry;Cork;12.50%;Medium;;['Sauvignon Blanc']
658;Finca Ferrer, Doscumbres, Uco Valley, Tupungato, 2012;Finca Ferrer;Doscumbres;2012;Still;Red;Argentina;Mendoza;Uco Valley;Dry;Natural Cork;14.50%;Full;;['Malbec', 'Syrah / Shiraz', 'Tannat']
659;Bressia, Conjuro, Uco Valley, Mendoza, Argentina, 2010;Bressia;Conjuro;2010;;Red;Argentina;Mendoza;Uco Valley;;;15.00%;;;['Cabernet Sauvignon', 'Malbec', 'Merlot']
660;Passionate Wine, Eterno Retorno, Uco Valley, Gualtallary;Passionate Wine;Eterno Retorno;2013;Still;Red;Argentina;Mendoza;Uco Valley;;;13.70%;;;['Malbec', 'Petit Verdot']
661;Catena, Adrianna Vineyard White Stones Chardonnay, Uco Valley 2012;Catena Zapata;Adrianna Vineyard White Stones Chardonnay;2012;;White;Argentina;Uco Valley;Uco Valley;;;13.00%;;;['Chardonnay']
662;Catena, Adrianna Vineyard White Bones Chardonnay, Uco Valley 2016;Catena Zapata;Adrianna Vineyard White Bones Chardonnay;2016;Still;White;Argentina;Mendoza;Uco Valley;Dry;Cork;13.10%;Medium;Oaked;['100% Chardonnay']
663;Luigi Bosca, Finca Los Nobles Cabernet Bouchet Field Blend, Lujan de Cuyo 2011;Luigi Bosca;Finca Los Nobles Cabernet Bouchet Field Blend;2011;Still;Red;Argentina;Mendoza;Luján de Cuyo;Dry;Natural Cork;14.50%;Full;;['Cabernet Franc']
664;Finca La Luz, Gran Callejón del Crimen Winemaker Selection, Uco Valley, 2015;Finca La Luz;Gran Callejón del Crimen Winemaker Selection;2015;Still;Red;Argentina;Mendoza;Uco Valley;Dry;Natural Cork;14.50%;Full;;['75% Malbec', '10% Merlot', '15% Petit Verdot']
665;Bodegas Caro, Mendoza, Argentina, 2016;Bodegas Caro;;2016;Still;Red;Argentina;Mendoza;;Dry;Natural Cork;14.50%;Full;;['Cabernet Sauvignon', 'Malbec']
666;Bodega Norton, Gernot Langes, Luján de Cuyo, Mendoza, 2014;Bodega Norton;Gernot Langes;2014;Still;Red;Argentina;Mendoza;Luján de Cuyo;Dry;Natural Cork;14.50%;Full;Oaked;['10% Cabernet Franc', '30% Cabernet Sauvignon', '60% Malbec']
667;Susana Balbo, Dominio del Plata Mandala Collection Malbec;Susana Balbo;Dominio del Plata Mandala Collection Malbec;2013;;Red;Argentina;Mendoza;Uco Valley;;;14.50%;;;['Malbec']
668;Pyros Wines, Special Blend, Pedernal Valley, San Juan, 2013;Pyros Wines;Special Blend;2013;Still;Red;Argentina;San Juan;Pedernal Valley;Dry;Natural Cork;14.00%;Full;;['8% Cabernet Sauvignon', '70% Malbec', '22% Syrah / Shiraz']
669;Pyros Wines, Single Vineyard Malbec, Pedernal Valley, 2013;Pyros Wines;Single Vineyard Malbec;2013;Still;Red;Argentina;San Juan;Pedernal Valley;Dry;Cork;14.50%;Medium;;['Malbec']
670;Corazon Del Sol, Soleado, Uco Valley, Mendoza, 2014;Corazon Del Sol;Soleado;2014;Still;Red;Argentina;Mendoza;Uco Valley;Dry;Natural Cork;14.50%;Full;Oaked;['18% Cabernet Sauvignon', '49% Malbec', '31% Merlot']
671;Casarena, Icono Blend, Mendoza, Argentina, 2011;Casarena;Icono Blend;2011;Still;Red;Argentina;Mendoza;;Dry;Natural Cork;14.50%;Full;;['60% Cabernet Sauvignon', '40% Malbec']
672;Bemberg, Pionero, Uco Valley, Gualtallary, Mendoza, 2013;Bemberg;Pionero;2013;Still;Red;Argentina;Mendoza;Uco Valley;Dry;Natural Cork;14.50%;Full;Oaked;['Cabernet Franc', 'Cabernet Sauvignon', 'Malbec']
673;Trapiche, Iscay Malbec-Cabernet Franc, Mendoza, 2013;Trapiche;Iscay Malbec-Cabernet Franc;2013;Still;Red;Argentina;Mendoza;;Dry;Natural Cork;14.50%;Full;;['30% Cabernet Franc', '70% Malbec']
674;Andeluna, Pasionado Cabernet Franc, Uco Valley, Gualtallary 2015;Andeluna;Pasionado Cabernet Franc;2015;Still;Red;Argentina;Mendoza;Uco Valley;Dry;Natural Cork;13.50%;Full;Oaked;['100% Cabernet Franc']
